0406050139,ESTUDO ELETROFISIOLÓGICO TERAPÊUTICO II (ABLAÇÃO DE VIAS ANÔMALAS ESQUERDAS),06,SIH,ATUA,4950.69,4950.69,4950.69
0407010017,DEGASTROGASTRECTOMIA C/ OU S/ VAGOTOMIA,06,SIH,ATUA,787.03,787.03,787.03
0407010025,DILATACAO ESOFAGICA / PILORICA,06,NÃO,ATUA,0,0,0
0407010033,ESOFAGECTOMIA DISTAL C/ TORACOTOMIA,06,SIH,ATUA,1833.56,1833.56,1833.56
0407010041,ESOFAGECTOMIA DISTAL S/ TORACOTOMIA,06,SIH,ATUA,1833.56,1833.56,1833.56
0407010050,ESOFAGECTOMIA VIDEOLAPAROSCOPICA,06,SIH,ATUA,777.23,777.23,777.23
0407010068,ESOFAGO-COLONPLASTIA,06,SIH,ATUA,1914.57,1914.57,1914.57
0407010076,ESOFAGOGASTRECTOMIA,06,SIH,ATUA,1185.67,1185.67,1185.67
0407010084,ESOFAGOPLASTIA / GASTROPLASTIA,06,SIH,ATUA,794.88,794.88,794.88
0407010092,ESOFAGORRAFIA CERVICAL,06,SIH,ATUA,787.65,787.65,787.65
0407010106,ESOFAGORRAFIA TORACICA,06,SIH,ATUA,787.65,787.65,787.65
0407010114,ESOFAGOSTOMIA,06,SIH,ATUA,787.85,787.85,787.85
0407010122,GASTRECTOMIA C/ OU S/ DESVIO DUODENAL,04,SIH,ATUA,4350,4350,4350
0407010130,GASTRECTOMIA PARCIAL C/ OU S/ VAGOTOMIA,06,SIH,ATUA,902.19,902.19,902.19
0407010149,GASTRECTOMIA TOTAL,06,SIH,ATUA,701.15,701.15,701.15
0407010157,GASTRECTOMIA VIDEOLAPAROSCOPICA,06,SIH,ATUA,609.16,609.16,609.16
0407010165,GASTROENTEROANASTOMOSE,06,SIH,ATUA,902.18,902.18,902.18
0407010173,GASTROPLASTIA C/ DERIVACAO INTESTINAL,04,SIH,ATUA,4350,4350,4350
0407010181,GASTROPLASTIA VERTICAL COM BANDA,04,SIH,ATUA,3850,3850,3850
0407010190,GASTRORRAFIA,06,SIH,ATUA,687.76,687.76,687.76
0407010203,GASTRORRAFIA VIDEOLAPAROSCOPICA,06,SIH,ATUA,550.58,550.58,550.58
0407010211,GASTROSTOMIA,06,SIH,ATUA,687.76,687.76,687.76
0407010220,GASTROSTOMIA VIDEOLAPAROSCOPICA,06,SIH,ATUA,520.56,520.56,520.56
0407010238,PILOROPLASTIA,06,SIH,ATUA,902.19,902.19,902.19
0407010246,RETIRADA DE CORPO ESTRANHO DO TUBO DIGESTIVO POR ENDOSCOPIA,06,SIA,ATUA,31.26,31.26,31.26
0407010254,RETIRADA DE POLIPO DO TUBO DIGESTIVO POR ENDOSCOPIA,06,SIA,ATUA,29.84,29.84,29.84
0407010262,TAMPONAMENTO DE LESOES HEMORRAGICAS DO APARELHO DIGESTIVO,06,NÃO,ATUA,0,0,0
0407010270,TRATAMENTO CIRURGICO DE ACALASIA (CARDIOMIOPLASTIA),06,SIH,ATUA,2270.21,2270.21,2270.21
0407010289,TRATAMENTO CIRURGICO DE DIVERTICULO DO TUBO DIGESTIVO,06,SIH,ATUA,822.91,822.91,822.91
0407010297,TRATAMENTO CIRURGICO DE REFLUXO GASTROESOFAGICO,06,SIH,ATUA,766.06,766.06,766.06
0407010300,TRATAMENTO CIRURGICO DE VARIZES ESOFAGICAS,06,SIH,ATUA,799.13,799.13,799.13
0407010319,TRATAMENTO ESCLEROSANTE / LIGADURA ELASTICA DE LESAO HEMORRAGICA DO APARELHO DIGESTIVO,06,SIA,ATUA,51.75,51.75,51.75
0407010327,TRATAMENTO ESCLEROSANTE DE LESOES NAO HEMORRAGICAS DO APARELHO DIGESTIVO INCLUINDO LIGADURA ELASTICA,06,SIA,ATUA,51.75,51.75,51.75
0407010335,TRATAMETO CIRURGICO DE MEGAESOFAGO SEM RESSECCAO / CONSERVADOR,06,SIH,ATUA,1846.37,1846.37,1846.37
0407010343,VAGOTOMIA C/ OPERACAO DE DRENAGEM,06,SIH,ATUA,709.69,709.69,709.69
0407010351,VAGOTOMIA SUPERSELETIVA / GASTRICA PROXIMAL,06,SIH,ATUA,778.46,778.46,778.46
0407010360,GASTRECTOMIA VERTICAL EM MANGA (SLEEVE),04,SIH,ATUA,4095,4095,4095
0407010378,TRATAMENTO DE INTERCORRENCIAS CIRURGICA POS- CIRURGIA BARIÁTRICA,04,SIH,ATUA,975,975,975
0407010386,CIRURGIA BARIÁTRICA POR VIDEOLAPAROSCOPIA,04,SIH,ATUA,6145,6145,6145
0407020012,AMPUTACAO COMPLETA ABDOMINO-PERINEAL DO RETO,06,SIH,ATUA,1403.9,1403.9,1403.9
0407020020,AMPUTACAO POR PROCIDENCIA DE RETO,06,SIH,ATUA,716.48,716.48,716.48
0407020039,APENDICECTOMIA,06,SIH,ATUA,414.62,414.62,414.62
0407020047,APENDICECTOMIA VIDEOLAPAROSCOPICA,06,SIH,ATUA,421.4,421.4,421.4
0407020055,CERCLAGEM DE ANUS,06,SIA,ATUA,13.06,13.06,13.06
0407020063,COLECTOMIA PARCIAL (HEMICOLECTOMIA),06,SIH,ATUA,1817.45,1817.45,1817.45
0407020071,COLECTOMIA TOTAL,06,SIH,ATUA,1403.91,1403.91,1403.91
0407020080,COLECTOMIA VIDEOLAPAROSCOPICA,06,SIH,ATUA,1280.75,1280.75,1280.75
0407020098,COLORRAFIA POR VIA ABDOMINAL,06,SIH,ATUA,629.1,629.1,629.1
0407020101,COLOSTOMIA,06,SIH,ATUA,1173.77,1173.77,1173.77
0407020110,CRIPTECTOMIA UNICA / MULTIPLA,06,SIH,ATUA,125.47,125.47,125.47
0407020128,DILATACAO DIGITAL / INSTRUMENTAL DO ANUS E/OU RETO,06,SIA,ATUA,13.06,13.06,13.06
0407020136,DRENAGEM DE ABSCESSO ANU-RETAL,06,SIA,ATUA,22.72,22.72,22.72
0407020144,DRENAGEM DE ABSCESSO ISQUIORRETAL,06,SIA,ATUA,22.72,22.72,22.72
0407020152,DRENAGEM DE HEMATOMA / ABSCESSO RETRO-RETAL,06,SIH,ATUA,468.38,468.38,468.38
0407020160,ELETROCAUTERIZACAO DE LESAO TRANSPARIETAL DE ANUS,06,SIA,ATUA,13.06,13.06,13.06
0407020179,ENTERECTOMIA,06,SIH,ATUA,1217.2,1217.2,1217.2
0407020187,ENTEROANASTOMOSE (QUALQUER SEGMENTO),06,SIH,ATUA,1174.36,1174.36,1174.36
0407020195,ENTEROPEXIA (QUALQUER SEGMENTO),06,SIH,ATUA,629.12,629.12,629.12
0407020209,ENTEROTOMIA E/OU ENTERORRAFIA C/ SUTURA / RESSECCAO (QUALQUER SEGMENTO),06,SIH,ATUA,788.04,788.04,788.04
0407020217,ESFINCTEROTOMIA INTERNA E TRATAMENTO DE FISSURA ANAL,06,SIH,ATUA,246.81,246.81,246.81
0407020225,EXCISAO DE LESAO / TUMOR ANU-RETAL,06,SIA,ATUA,21.68,21.68,21.68
0407020233,EXCISAO DE LESAO INTESTINAL / MESENTERICA LOCALIZADA,06,SIH,ATUA,650.08,650.08,650.08
0407020241,FECHAMENTO DE ENTEROSTOMIA (QUALQUER SEGMENTO),06,SIH,ATUA,650.09,650.09,650.09
0407020250,FECHAMENTO DE FISTULA DE COLON,06,SIH,ATUA,896.25,896.25,896.25
0407020268,FECHAMENTO DE FISTULA DE RETO,06,SIH,ATUA,374.14,374.14,374.14
0407020276,FISTULECTOMIA / FISTULOTOMIA ANAL,06,SIH,ATUA,254.12,254.12,254.12
0407020284,HEMORROIDECTOMIA,06,SIH,ATUA,315.94,315.94,315.94
0407020292,HERNIORRAFIA C/ RESSECCAO INTESTINAL (HERNIA ESTRANGULADA),06,SIH,ATUA,378.69,378.69,378.69
0407020306,JEJUNOSTOMIA / ILEOSTOMIA,06,SIH,ATUA,942.57,942.57,942.57
0407020314,LIGADURA ELASTICA DE HEMORROIDAS (SESSAO),06,SIA,ATUA,14.77,14.77,14.77
0407020322,PLASTICA ANAL EXTERNA / ESFINCTEROPLASTIA ANAL,06,SIH,ATUA,178.24,178.24,178.24
0407020330,PROCTOCOLECTOMIA TOTAL C/ RESERVATORIO ILEAL,06,SIH,ATUA,1453.79,1453.79,1453.79
0407020349,PROCTOPEXIA ABDOMINAL POR PROCIDENCIA DO RETO,06,SIH,ATUA,394.05,394.05,394.05
0407020357,PROCTOPLASTIA E PROCTORRAFIA POR VIA PERINEAL,06,SIH,ATUA,374.14,374.14,374.14
0407020365,REDUCAO CIRURGICA DE VOLVO POR LAPAROTOMIA,06,SIH,ATUA,791.22,791.22,791.22
0407020373,REDUCAO MANUAL DE PROCIDENCIA DE RETO,06,NÃO,ATUA,0,0,0
0407020381,REMOCAO CIRURGICA DE FECALOMA,06,SIH,ATUA,427.17,427.17,427.17
0407020390,RETIRADA DE CORPO ESTRANHO / POLIPOS DO RETO / COLO SIGMOIDE,06,SIA,ATUA,13.63,13.63,13.63
0407020403,RETOSSIGMOIDECTOMIA ABDOMINAL,06,SIH,ATUA,1453.79,1453.79,1453.79
0407020411,RETOSSIGMOIDECTOMIA ABDOMINO-PERINEAL,06,SIH,ATUA,1453.79,1453.79,1453.79
0407020420,TRATAMENTO CIRURGICO DE ANOMALIAS CONGENITAS DO ANUS E RETO,06,SIH,ATUA,212.85,212.85,212.85
0407020438,TRATAMENTO CIRURGICO DE AUSENCIA DO RETO (ABDOMINO-PERINEAL),06,SIH,ATUA,1433.83,1433.83,1433.83
0407020446,TRATAMENTO CIRURGICO DE ILEO MECONIAL,06,SIH,ATUA,944.53,944.53,944.53
0407020454,TRATAMENTO CIRURGICO DE IMPERFURACAO MEMBRANOSA DO ANUS,06,SIH,ATUA,239.45,239.45,239.45
0407020462,TRATAMENTO CIRURGICO DE MA ROTACAO INTESTINAL,06,SIH,ATUA,1017.86,1017.86,1017.86
0407020470,TRATAMENTO CIRURGICO DE PROLAPSO ANAL,06,SIH,ATUA,183.64,183.64,183.64
0407020489,TRATAMENTO CIRURGICO DE PRURIDO ANAL,06,SIA,ATUA,22.62,22.62,22.62
0407020497,TRATAMENTO ESCLEROSANTE DE HEMORROIDAS (POR SESSAO),06,SIA,ATUA,13.63,13.63,13.63
0407030018,ANASTOMOSE BILEO-DIGESTIVA,06,SIH,ATUA,1161.31,1161.31,1161.31
0407030026,COLECISTECTOMIA,06,SIH,ATUA,695.77,695.77,695.77
0407030034,COLECISTECTOMIA VIDEOLAPAROSCOPICA,06,SIH,ATUA,693.05,693.05,693.05
0407030042,COLECISTOSTOMIA,06,SIH,ATUA,632.5,632.5,632.5
0407030050,COLEDOCOPLASTIA,06,SIH,ATUA,569.39,569.39,569.39
0407030069,COLEDOCOTOMIA C/ OU S/ COLECISTECTOMIA,06,SIH,ATUA,617.41,617.41,617.41
0407030077,COLEDOCOTOMIA VIDEOLAPAROSCOPICA,06,SIH,ATUA,564.79,564.79,564.79
0407030085,COLOCACAO DE PROTESE BILIAR,06,SIA,ATUA,92.95,92.95,92.95
0407030093,DILATACAO PERCUTANEA DE ESTENOSES E ANASTOMOSES BILIARES,06,SIA,ATUA,92.95,92.95,92.95
0407030107,DRENAGEM BILIAR PERCUTANEA EXTERNA,06,SIA,ATUA,92.95,92.95,92.95
0407030115,DRENAGEM BILIAR PERCUTANEA INTERNA,06,SIA,ATUA,92.95,92.95,92.95
0407030123,ESPLENECTOMIA,06,SIH,ATUA,975.98,975.98,975.98
0407030131,HEPATECTOMIA PARCIAL,06,SIH,ATUA,1195.01,1195.01,1195.01
0407030140,HEPATORRAFIA,06,SIH,ATUA,1110.87,1110.87,1110.87
0407030158,HEPATORRAFIA COMPLEXA C/ LESAO DE ESTRUTURAS VASCULARES BILIARES,06,SIH,ATUA,1110.87,1110.87,1110.87
0407030166,HEPATOTOMIA E DRENAGEM DE ABSCESSO / CISTO,06,SIH,ATUA,859.07,859.07,859.07
0407030174,MARSUPIALIZACAO DE ABSCESSO / CISTO,06,SIH,ATUA,863.53,863.53,863.53
0407030182,PANCREATECTOMIA PARCIAL,06,SIH,ATUA,774.95,774.95,774.95
0407030190,PANCREATECTOMIA VIDEOLAPAROSCOPICA,06,SIH,ATUA,684.13,684.13,684.13
0407030204,PANCREATO-DUODENECTOMIA,06,SIH,ATUA,1603.46,1603.46,1603.46
0407030212,PANCREATO-ENTEROSTOMIA,06,SIH,ATUA,1577.6,1577.6,1577.6
0407030220,PANCREATOTOMIA P/ DRENAGEM,06,SIH,ATUA,774.96,774.96,774.96
0407030239,RETIRADA PERCUTANEA DE CALCULOS BILIARES,06,SIA,ATUA,97,97,97
0407030247,TRATAMENTO CIRURGICO DE CISTOS PANCREATICOS,06,SIH,ATUA,1577.59,1577.59,1577.59
0407030255,COLANGIOPANCREATOGRAFIA RETRÓGRADA ENDOSCÓPICA TERAPÊUTICA,04,SIH,ATUA,#NULL!,2023.53,2023.53
0407040013,DRENAGEM DE ABSCESSO PELVICO,06,SIH,ATUA,717.13,717.13,717.13
0407040021,DRENAGEM DE ABSCESSO SUBFRENICO,06,SIH,ATUA,982.83,982.83,982.83
0407040030,DRENAGEM DE HEMATOMA / ABSCESSO PRE-PERITONEAL,06,SIH,ATUA,437.83,437.83,437.83
0407040048,HERNIOPLASTIA DIAFRAGMATICA (VIA ABDOMINAL),06,SIH,ATUA,808.13,808.13,808.13
0407040056,HERNIOPLASTIA DIAFRAGMATICA (VIA TORACICA),06,SIH,ATUA,830.9,830.9,830.9
0407040064,HERNIOPLASTIA EPIGASTRICA,06,SIH,ATUA,559.87,559.87,559.87
0407040072,HERNIOPLASTIA EPIGASTRICA VIDEOLAPAROSCOPICA,06,SIH,ATUA,361.54,361.54,361.54
0407040080,HERNIOPLASTIA INCISIONAL,06,SIH,ATUA,539.92,539.92,539.92
0407040099,HERNIOPLASTIA INGUINAL (BILATERAL),06,SIH,ATUA,426.02,426.02,426.02
0407040102,HERNIOPLASTIA INGUINAL / CRURAL (UNILATERAL),06,SIH,ATUA,445.51,445.51,445.51
0407040110,HERNIOPLASTIA RECIDIVANTE,06,SIH,ATUA,416.43,416.43,416.43
0407040129,HERNIOPLASTIA UMBILICAL,06,SIH,ATUA,434.99,434.99,434.99
0407040137,HERNIORRAFIA INGUINAL VIDEOLAPAROSCOPICA,06,SIH,ATUA,376.95,376.95,376.95
0407040145,HERNIORRAFIA S/ RESSECCAO INTESTINAL (HERNIA ESTRANGULADA ),06,SIH,ATUA,419.94,419.94,419.94
0407040153,HERNIORRAFIA UMBILICAL VIDEOLAPAROSCOPICA,06,SIH,ATUA,360.66,360.66,360.66
0407040161,LAPAROTOMIA EXPLORADORA,06,SIH,ATUA,637.19,637.19,637.19
0407040170,LAPAROTOMIA VIDEOLAPAROSCOPICA PARA DRENAGEM E/OU BIOPSIA,06,SIH,ATUA,606.15,606.15,606.15
0407040188,LIBERACAO DE ADERENCIAS INTESTINAIS,06,SIH,ATUA,829.06,829.06,829.06
0407040196,PARACENTESE ABDOMINAL,06,SIA,ATUA,12.27,12.27,12.27
0407040200,PERITONIOSTOMIA C/ TELA INORGANICA,06,SIH,ATUA,817.53,817.53,817.53
0407040218,PNEUMOPERITONIO (POR SESSAO),06,SIA,ATUA,13.63,13.63,13.63
0407040226,REPARACAO DE OUTRAS HERNIAS,06,SIH,ATUA,382.19,382.19,382.19
0407040234,RESSECCAO DO EPIPLOM,06,SIH,ATUA,499.37,499.37,499.37
0407040242,RESSUTURA DE PAREDE ABDOMINAL (POR DEISCENCIA TOTAL / EVISCERACAO),06,SIH,ATUA,531.89,531.89,531.89
0407040250,TRATAMENTO CIRURGICO DE PERITONITE,06,SIH,ATUA,976.25,976.25,976.25
0407040269,VAGOTOMIA VIDEOLAPAROSCOPICA,06,SIH,ATUA,798.06,798.06,798.06
0408010010,ARTRODESE DE GRANDES ARTICULAÇÕES ESCAPULO-TORÁCICAS,06,SIH,ATUA,354.91,354.91,354.91
0408010029,ARTRODESE DE GRANDES ARTICULAÇÕES ESCAPULO-UMERAIS,06,SIH,ATUA,377.4,377.4,377.4
0408010037,ARTROPLASTIA ESCAPULO-UMERAL (NÃO CONVENCIONAL),06,SIH,ATUA,592.14,592.14,592.14
0408010045,ARTROPLASTIA ESCAPULO-UMERAL PARCIAL,06,SIH,ATUA,613.35,613.35,613.35
0408010053,ARTROPLASTIA ESCAPULO-UMERAL TOTAL,06,SIH,ATUA,592.14,592.14,592.14
0408010061,ARTROPLASTIA ESCAPULO-UMERAL TOTAL - REVISÃO / RECONSTRUÇÃO,06,SIH,ATUA,597.8,597.8,597.8
0408010070,DESARTICULACAO DA ARTICULACAO ESCAPULO-UMERAL,06,SIH,ATUA,446.09,446.09,446.09
0408010088,DESARTICULACAO INTERESCAPULO-TORÁCICA,06,SIH,ATUA,1135.17,1135.17,1135.17
0408010096,ESCAPULOPEXIA C/ OU S/ OSTEOTOMIA DA ESCAPULA / RESSECÇÃO BARRA OMO-CERVICAL,06,SIH,ATUA,1600.27,1600.27,1600.27
0408010100,OSTECTOMIA DA CLAVÍCULA OU DA ESCÁPULA,06,SIH,ATUA,297.12,297.12,297.12
0408010118,OSTEOTOMIA DA CLAVÍCULA OU DA ESCÁPULA,06,SIH,ATUA,284.27,284.27,284.27
0408010126,REDUCAO INCRUENTA DE FRATURA E FRATURA-LUXACAO AO NIVEL DA CINTURA ESCAPULAR,06,SIA,ATUA,44.28,44.28,44.28
0408010134,REDUCAO INCRUENTA DE LUXAÇÃO OU FRATURA / LUXAÇÃO ESCÁPULO-UMERAL,06,SIA,ATUA,41.1,41.1,41.1
0408010142,REPARO DE ROTURA DO MANGUITO ROTADOR (INCLUI PROCEDIMENTOS DESCOMPRESSIVOS),06,SIH,ATUA,295.75,295.75,295.75
0408010150,TRATAMENTO CIRÚRGICO DE FRATURA DA CLAVÍCULA,06,SIH,ATUA,378.7,378.7,378.7
0408010169,TRATAMENTO CIRURGICO DE FRATURA DO COLO E CAVIDADE GLENOIDE DE ESCAPULA,06,SIH,ATUA,379.15,379.15,379.15
0408010177,TRATAMENTO CIRURGICO DE FRATURA DO CORPO DE ESCAPULA,06,SIH,ATUA,301.4,301.4,301.4
0408010185,TRATAMENTO CIRURGICO DE LUXACAO / FRATURA-LUXACAO ACROMIO-CLAVICULAR,06,SIH,ATUA,377.59,377.59,377.59
0408010193,TRATAMENTO CIRURGICO DE LUXACAO / FRATURA-LUXACAO ESCAPULO-UMERAL AGUDA,06,SIH,ATUA,301.4,301.4,301.4
0408010207,TRATAMENTO CIRURGICO DE LUXACAO / FRATURA-LUXACAO ESTERNO-CLAVICULAR,06,SIH,ATUA,452.9,452.9,452.9
0408010215,TRATAMENTO CIRURGICO DE LUXACAO RECIDIVANTE / HABITUAL DE ARTICULACAO ESCAPULO-UMERAL,06,SIH,ATUA,379.15,379.15,379.15
0408010223,TRATAMENTO CIRURGICO DE RETARDO DE CONSOLIDACAO DA PSEUDARTROSE DE CLAVICULA / ESCAPULA,06,SIH,ATUA,284.27,284.27,284.27
0408010231,TRATAMENTO CIRÚRGICO DA SÍNDROME DO IMPACTO SUB-ACROMIAL,06,SIH,ATUA,295.75,295.75,295.75
0408020016,AMPUTAÇÃO / DESARTICULAÇÃO DE MÃO E PUNHO,06,SIH,ATUA,193.3,193.3,193.3
0408020024,AMPUTAÇÃO / DESARTICULAÇÃO DE MEMBROS SUPERIORES,06,SIH,ATUA,359.46,359.46,359.46
0408020032,ARTRODESE DE MÉDIAS / GRANDES ARTICULAÇÕES DE MEMBRO SUPERIOR,06,SIH,ATUA,230.37,230.37,230.37
0408020040,ARTROPLASTIA DE ARTICULAÇÃO DA MÃO,06,SIH,ATUA,316.48,316.48,316.48
0408020059,ARTROPLASTIA DE CABEÇA DO RÁDIO,06,SIH,ATUA,282.66,282.66,282.66
0408020067,ARTROPLASTIA DE PUNHO,06,SIH,ATUA,246.43,246.43,246.43
0408020075,ARTROPLASTIA TOTAL DE COTOVELO,06,SIH,ATUA,494.93,494.93,494.93
0408020083,ARTROPLASTIA TOTAL DE COTOVELO (REVISAO / RECONSTRUCAO),06,SIH,ATUA,402.58,402.58,402.58
0408020091,RESSECÇÃO DO OLECRANO E/OU CABEÇA DO RÁDIO,06,SIH,ATUA,309.51,309.51,309.51
0408020105,FASCIOTOMIA DE MEMBROS SUPERIORES,06,SIH,ATUA,200.51,200.51,200.51
0408020113,INSTALACAO DE TRAÇÃO ESQUELÉTICA DO MEMBRO SUPERIOR,06,SP,ATUA,15,15,15
0408020121,REALINHAMENTO DE MECANISMO EXTENSOR DOS DEDOS DA MÃO,06,SIH,ATUA,205.53,205.53,205.53
0408020130,RECONSTRUÇÃO CAPSULO-LIGAMENTAR DE COTOVELO PUNHO,06,SIH,ATUA,241.43,241.43,241.43
0408020148,RECONSTRUÇÃO DE POLIA TENDINOSA DOS DEDOS DA MÃO,06,SIH,ATUA,205.53,205.53,205.53
0408020156,REDUÇÃO INCRUENTA DE FRATURA / LESÃO FISARIA DE COTOVELO,06,SIH,ATUA,152.37,152.37,152.37
0408020164,REDUÇAO INCRUENTA DE FRATURA / LESÃO FISARIA DO EXTREMO PROXIMAL DO ÚMERO,06,SIA,ATUA,41.1,41.1,41.1
0408020172,REDUÇÃO INCRUENTA DE FRATURA / LESÃO FISARIA NO PUNHO,06,SIA,ATUA,38.74,38.74,38.74
0408020180,REDUÇÃO INCRUENTA DE FRATURA / LUXAÇÃO DE MONTEGGIA OU DE GALEAZZI,06,SIA,ATUA,37.5,37.5,37.5
0408020199,REDUÇÃO INCRUENTA DE FRATURA DA DIÁFISE DO ÚMERO,06,SIA,ATUA,37.88,37.88,37.88
0408020202,REDUÇÃO INCRUENTA DE FRATURA DIAFISARIA DOS OSSOS DO ANTEBRAÇO,06,SIA,ATUA,37.88,37.88,37.88
0408020210,REDUÇÃO INCRUENTA DE FRATURA DOS METACARPIANOS,06,SIH,ATUA,107.24,107.24,107.24
0408020229,REDUÇÃO INCRUENTA DE LUXAÇÃO / FRATURA-LUXAÇÃO DO COTOVELO,06,SIA,ATUA,37.5,37.5,37.5
0408020237,REDUCAO INCRUENTA DE LUXACAO / FRATURA-LUXACAO E METACARPO-FALANGIANA / METATARSO-FALANGIANA / INTER-FALANGIANA,06,SIH,2014,107.24,107.24,107.24
0408020245,REDUÇÃO INCRUENTA DE LUXAÇÃO OU FRATURA / LUXACAO NO PUNHO,06,SIA,ATUA,38.74,38.74,38.74
0408020253,REIMPLANTE DO OMBRO ATÉ O TERÇO MÉDIO DO ANTEBRAÇO,06,SIH,ATUA,2461.12,2461.12,2461.12
0408020261,REIMPLANTE DO TERÇO DISTAL DO ANTEBRAÇO ATÉ OS METACARPIANOS,06,SIH,ATUA,2461.12,2461.12,2461.12
0408020270,REIMPLANTE OU REVASCULARIZAÇÃO AO NÍVEL DA MÃO E OUTROS DEDOS (EXCETO POLEGAR),06,SIH,ATUA,358.84,358.84,358.84
0408020288,REIMPLANTE OU REVASCULARIZAÇÃO DO POLEGAR,06,SIH,ATUA,488.93,488.93,488.93
0408020296,REVISÃO CIRÚGICA DE COTO DE AMPUTAÇÃO DO MEMBRO SUPERIOR (EXCETO MÃO),06,SIA,ATUA,20,20,20
0408020300,TENOSINOVECTOMIA EM MEMBRO SUPERIOR,06,SIA,ATUA,28.42,28.42,28.42
0408020318,TRANSPOSIÇÃO DA ULNA PARA O RÁDIO,06,SIH,ATUA,366.37,366.37,366.37
0408020326,TRATAMENTO CIRÚRGICO DE DEDO EM GATILHO,06,SIH,ATUA,241.15,241.15,241.15
0408020334,TRATAMENTO CIRÚRGICO DE FRATURA / LESÃO FISARIA DA EXTREMIDADE PROXIMAL DO UMERO,06,SIH,ATUA,498.98,498.98,498.98
0408020342,TRATAMENTO CIRÚRGICO DE FRATURA / LESÃO FISARIA DAS FALANGES DA MÃO (COM FIXAÇÃO),06,SIH,ATUA,192.6,192.6,192.6
0408020350,TRATAMENTO CIRÚRGICO DE FRATURA / LESÃO FISARIA DE EPI~CÔNDILO / EPITROCLEA DO ÚMERO,06,SIH,ATUA,311.42,311.42,311.42
0408020369,TRATAMENTO CIRÚRGICO DE FRATURA / LESÃO FISARIA DO CÔNDILO / TRÓCLEA/APOFISE CORONÓIDE DO ULNA / CABEÇA DO RÁDIO,06,SIH,ATUA,368.64,368.64,368.64
0408020377,TRATAMENTO CIRÚRGICO DE FRATURA / LESÃO FISARIA DOS METACARPIANOS,06,SIH,ATUA,258.26,258.26,258.26
0408020385,TRATAMENTO CIRÚRGICO DE FRATURA / LESÃO FISARIA SUPRACONDILIANA DO ÚMERO,06,SIH,ATUA,499.74,499.74,499.74
0408020393,TRATAMENTO CIRÚGICO DE FRATURA DA DIÁFISE DO ÚMERO,06,SIH,ATUA,364.95,364.95,364.95
0408020407,TRATAMENTO CIRÚRGICO DE FRATURA DA EXTREMIDADE / METÁFISE DISTAL DOS OSSOS DO ANTEBRAÇO,06,SIH,ATUA,253.8,253.8,253.8
0408020415,TRATAMENTO CIRÚRGICO DE FRATURA DE EXTREMIDADES / METÁFISE PROXIMAL DOS OSSOS DO ANTEBRAÇO,06,SIH,ATUA,366.37,366.37,366.37
0408020423,TRATAMENTO CIRÚRGICO DE FRATURA DIAFISARIA DE AMBOS OS OSSOS DO ANTEBRAÇO (C/ SINTESE),06,SIH,ATUA,547.3,547.3,547.3
0408020431,TRATAMENTO CIRÚRGICO DE FRATURA DIAFISARIA ÚNICA DO RÁDIO / DA ULNA,06,SIH,ATUA,265.29,265.29,265.29
0408020440,TRATAMENTO CIRÚRGICO DE FRATURA LESÃO FISARIA DOS OSSOS DO ANTEBRAÇO,06,SIH,ATUA,201.02,201.02,201.02
0408020458,TRATAMENTO CIRÚRGICO DE FRATURA-LUXAÇÃO DE GALEAZZI / MONTEGGIA / ESSEX-LOPRESTI,06,SIH,ATUA,366.37,366.37,366.37
0408020466,TRATAMENTO CIRÚRGICO DE FRATURAS DOS OSSOS DO CARPO,06,SIH,ATUA,250.56,250.56,250.56
0408020474,TRATAMENTO CIRÚRGICO DE GIGANTISMO DA MÃO,06,SIH,ATUA,219.67,219.67,219.67
0408020482,TRATAMENTO CIRÚRGICO DE LESÃO AGUDA CAPSULO-LIGAMENTAR DO MEMBRO SUPERIOR: COTOVELO / PUNHO,06,SIH,ATUA,241.43,241.43,241.43
0408020490,TRATAMENTO CIRÚRGICO DE LESÃO DA MUSCULATURA INTRÍNSECA DA MÃO,06,SIH,ATUA,222.09,222.09,222.09
0408020504,TRATAMENTO CIRÚRGICO DE LESÃO EVOLUTIVA FISARIA NO MEMBRO SUPERIOR,06,SIH,ATUA,261.64,261.64,261.64
0408020512,TRATAMENTO CIRÚRGICO DE LUXAÇÃO / FRATURA-LUXAÇÃO CARPO-METACARPIANA,06,SIH,ATUA,208.94,208.94,208.94
0408020520,TRATAMENTO CIRÚRGICO DE LUXAÇÃO / FRATURA-LUXACAO DOS OSSOS DO CARPO,06,SIH,ATUA,201.02,201.02,201.02
0408020539,TRATAMENTO CIRÚRGICO DE LUXAÇÃO / FRATURA-LUXAÇÃO METACARPO-FALANGIANA,06,SIH,ATUA,192.6,192.6,192.6
0408020547,TRATAMENTO CIRÚRGICO DE LUXAÇÃO OU FRATURA-LUXAÇÃO DO COTOVELO,06,SIH,ATUA,311.42,311.42,311.42
0408020555,TRATAMENTO CIRÚRGICO DE PSEUDARTROSE / RETARDO DE CONSOLIDAÇÃO / PERDA ÓSSEA DA MÃO,06,SIH,ATUA,203.12,203.12,203.12
0408020563,TRATAMENTO CIRÚRGICO DE PSEUDARTROSE / RETARDO DE CONSOLIDAÇÃO / PERDA ÓSSEA DO ANTEBRAÇO,06,SIH,ATUA,471.38,471.38,471.38
0408020571,TRATAMENTO CIRÚRGICO DE PSEUDARTROSE / RETARDO DE CONSOLIDAÇÃO / PERDA ÓSSEA DO ÚMERO,06,SIH,ATUA,377.31,377.31,377.31
0408020580,TRATAMENTO CIRÚRGICO DE PSEUDARTROSE AO NÍVEL DO COTOVELO,06,SIH,ATUA,444.08,444.08,444.08
0408020598,TRATAMENTO CIRÚRGICO DE PSEUDARTROSE NA REGIÃO METAFISE-EPIFISÁRIA DISTAL DO RÁDIO E ULNA,06,SIH,ATUA,229.29,229.29,229.29
0408020601,TRATAMENTO CIRÚRGICO DE PSEUDO-RETARDO / CONSOLIDAÇÃO / PERDA ÓSSEA AO ÍIVEL DO CARPO,06,SIH,ATUA,229.29,229.29,229.29
0408020610,TRATAMENTO CIRÚRGICO DE ROTURA / DESINSERÇÃO / ARRANCAMENTO CAPSULO-TENO-LIGAMENTAR NA MÃO,06,SIH,ATUA,258.26,258.26,258.26
0408020628,TRATAMENTO CIRÚRGICO DE SINDACTILIA DA MÃO (POR ESPACO INTERDIGITAL),06,SIH,ATUA,192.6,192.6,192.6
0408020636,TRATAMENTO CIRÚRGICO DE SINOSTOSE RÁDIO ULNAR,06,SIH,ATUA,371.88,371.88,371.88
0408020644,TRATAMENTO CIRÚRGICO P/ CENTRALIZAÇÃO DO PUNHO,06,SIH,ATUA,246.43,246.43,246.43
0408030011,ARTRODESE CERVICAL / CERVICO TORÁCICA POSTERIOR CINCO NIVEIS,06,SIH,ATUA,2781.7,2781.7,2781.7
0408030020,ARTRODESE CERVICAL / CERVICO-TORÁCICA POSTERIOR UM NIVEL,06,SIH,ATUA,1576,1576,1576
0408030038,ARTRODESE CERVICAL / CERVICO-TORÁCICA POSTERIOR DOIS NÍVEIS,06,SIH,ATUA,1303,1303,1303
0408030046,ARTRODESE CERVICAL / CERVICO-TORÁCICA POSTERIOR SEIS NÍVEIS,06,SIH,ATUA,1600.27,1600.27,1600.27
0408030054,ARTRODESE CERVICAL / CERVICO-TORÁCICA POSTERIOR TRES NÍVEIS,06,SIH,ATUA,2781.7,2781.7,2781.7
0408030062,ARTRODESE CERVICAL ANTERIOR TRÊS NIVEIS,06,SIH,ATUA,2072.72,2072.72,2072.72
0408030070,ARTRODESE CERVICAL ANTERIOR DOIS NÍVEIS,06,SIH,ATUA,1413,1413,1413
0408030089,ARTRODESE CERVICAL ANTERIOR C1-C2 VIA TRANS-ORAL / EXTRA-ORAL,06,SIH,ATUA,1719.06,1719.06,1719.06
0408030097,ARTRODESE CERVICAL ANTERIOR CINCO NÍVEIS,06,SIH,ATUA,2781.7,2781.7,2781.7
0408030100,ARTRODESE CERVICAL ANTERIOR QUATRO NÍVEIS,06,SIH,ATUA,2781.7,2781.7,2781.7
0408030119,ARTRODESE CERVICAL ANTERIOR UM NÍVEL,06,SIH,ATUA,1413,1413,1413
0408030127,ARTRODESE CERVICAL POSTERIOR C1-C2,06,SIH,ATUA,1303.15,1303.15,1303.15
0408030135,ARTRODESE INTERSOMATICA VIA POSTERIOR / POSTERO-LATERAL UM NÍVEL,06,SIH,ATUA,1883.27,1883.27,1883.27
0408030143,ARTRODESE INTERSOMATICA VIA POSTERIOR / POSTERO-LATERAL DOIS NÍVEIS,06,SIH,ATUA,2166.29,2166.29,2166.29
0408030151,ARTRODESE INTERSOMATICA VIA POSTERIOR / POSTERO-LATERAL QUATRO NÍVEIS,06,SIH,ATUA,2166.29,2166.29,2166.29
0408030160,ARTRODESE INTERSOMATICA VIA POSTERIOR / POSTERO-LATERAL TRES NÍVEIS,06,SIH,ATUA,2166.29,2166.29,2166.29
0408030178,ARTRODESE OCCIPTO-CERVICAL (C2) POSTERIOR,06,SIH,ATUA,1554,1554,1554
0408030186,ARTRODESE OCCIPTO-CERVICAL (C3)POSTERIOR,06,SIH,ATUA,1554,1554,1554
0408030194,ARTRODESE OCCIPTO-CERVICAL (C4)POSTERIOR,06,SIH,ATUA,1554,1554,1554
0408030208,ARTRODESE OCCIPTO-CERVICAL (C5) POSTERIOR,06,SIH,ATUA,1554,1554,1554
0408030216,ARTRODESE OCCIPTO-CERVICAL (C6)POSTERIOR,06,SIH,ATUA,1554,1554,1554
0408030224,ARTRODESE OCCIPTO-CERVICAL (C7) POSTERIOR,06,SIH,ATUA,1554,1554,1554
0408030232,ARTRODESE TORACO-LOMBO-SACRA ANTERIOR UM NÍVEL,06,SIH,ATUA,1722.29,1722.29,1722.29
0408030240,ARTRODESE TORACO-LOMBO-SACRA ANTERIOR DOIS NIVEIS,06,SIH,ATUA,1720.27,1720.27,1720.27
0408030259,"ARTRODESE TORACO-LOMBO-SACRA ANTERIOR, TRES NIVEIS,",06,SIH,ATUA,2781.7,2781.7,2781.7
0408030267,ARTRODESE TORACO-LOMBO-SACRA POSTERIOR UM NÍVEL,06,SIH,ATUA,1722.37,1722.37,1722.37
0408030275,ARTRODESE TORACO-LOMBO-SACRA POSTERIOR TRÊS NIVEIS,06,SIH,ATUA,2781.7,2781.7,2781.7
0408030283,ARTRODESE TORACO-LOMBO-SACRA POSTERIOR CINCO NÍVEIS,06,SIH,ATUA,2781.7,2781.7,2781.7
0408030291,"ARTRODESE TORACO-LOMBO-SACRA POSTERIOR, DOIS NÍVEIS,",06,SIH,ATUA,2781.7,2781.7,2781.7
0408030305,"ARTRODESE TORACO-LOMBO-SACRA POSTERIOR, QUATRO NÍVEIS,",06,SIH,ATUA,2781.7,2781.7,2781.7
0408030313,"ARTRODESE TORACO-LOMBO-SACRA POSTERIOR, SEIS NÍVEIS,",06,SIH,ATUA,2781.7,2781.7,2781.7
0408030321,"ARTRODESE TORACO-LOMBO-SACRA POSTERIOR, SETE NIVEIS,",06,SIH,ATUA,2781.7,2781.7,2781.7
0408030330,COSTO-TRANSVERSECTOMIA,06,SIH,ATUA,1171.83,1171.83,1171.83
0408030348,COSTOPLASTIA (3 OU MAIS COSTELAS),06,SIH,ATUA,492.59,492.59,492.59
0408030356,DESCOMPRESSÃO DA JUNÇÃO CRANIO-CERVICAL VIA TRANSORAL / RETROFARINGEA,06,SIH,ATUA,1783.1,1783.1,1783.1
0408030364,DESCOMPRESSÃO OSSEA NA JUNÇÃO CRANIO-CERVICAL VIA POSTERIOR,06,SIH,ATUA,1265.63,1265.63,1265.63
0408030372,DESCOMPRESSÃO OSSEA NA JUNÇÃO CRANIO-CERVICAL VIA POSTERIOR C/ DUROPLASTIA,06,SIH,ATUA,1444.26,1444.26,1444.26
0408030380,DISCECTOMIA CERVICAL / LOMBAR / LOMBO-SACRA POR VIA POSTERIOR (1 NÍVEL C/ MICROSCÓPIO),06,SIH,ATUA,1720.27,1720.27,1720.27
0408030399,DISCECTOMIA CERVICAL / LOMBAR / LOMBO-SACRA POR VIA POSTERIOR (UM NÍVEL),06,SIH,ATUA,764.71,764.71,764.71
0408030402,DISCECTOMIA CERVICAL / LOMBAR / LOMBO-SACRA POR VIA POSTERIOR (DOIS NÍVEIS),06,SIH,ATUA,1005.48,1005.48,1005.48
0408030410,DISCECTOMIA CERVICAL / LOMBAR / LOMBO-SACRA POR VIA POSTERIOR (DOIS OU MAIS NÍVEIS C/ MICROSCÓPIO),06,SIH,ATUA,1785.92,1785.92,1785.92
0408030429,DISCECTOMIA CERVICAL ANTERIOR (ATÉ 2 NÍVEIS C/ MICROSCÓPIO),06,SIH,ATUA,1720.27,1720.27,1720.27
0408030437,DISCECTOMIA CERVICAL POR VIA ANTERIOR (1 NÍVEL),06,SIH,ATUA,1343,1343,1343
0408030445,DISCECTOMIA CERVICAL POR VIA ANTERIOR (2 OU MAIS NÍVEIS),06,SIH,ATUA,1726.52,1726.52,1726.52
0408030453,DISCECTOMIA TORACO-LOMBO-SACRA POR VIA ANTERIOR (C/ 2 OU MAIS NÍVEIS),06,SIH,ATUA,1706.27,1706.27,1706.27
0408030461,DISCECTOMIA TORACO-LOMBO-SACRA POR VIA ANTERIOR (1 NÍVEL),06,SIH,ATUA,1706.27,1706.27,1706.27
0408030470,DRENAGEM CIRÚRGICA DO ILIOPSOAS,06,SIH,ATUA,298.78,298.78,298.78
0408030488,INSTALAÇÃO DE TRAÇÃO CRANIANA,06,SP,ATUA,35,35,35
0408030500,RESSECÇÃO DE 2 OU MAIS CORPOS VERTEBRAIS CERVICAIS,06,SIH,ATUA,1953.23,1953.23,1953.23
0408030518,RESSECÇÃO DE 2 OU MAIS CORPOS VERTEBRAIS TORACO-LOMBO-SACROS,06,SIH,ATUA,1953.23,1953.23,1953.23
0408030526,RESSEÇÃO DE COCCIX,06,SIH,ATUA,195.99,195.99,195.99
