0416110088,TIMECTOMIA EM ONCOLOGIA,06,SIH,ATUA,4186.64,4186.64,4186.64
0416120016,EXTIRPACAO DE MAMILO EM ONCOLOGIA,06,SIH,2012,169.66,169.66,169.66
0416120024,MASTECTOMIA RADICAL COM LINFADENECTOMIA AXILAR EM ONCOLOGIA,06,SIH,ATUA,2462.85,2462.85,2462.85
0416120032,MASTECTOMIA SIMPLES EM ONCOLOGIA,06,SIH,ATUA,2045.07,2045.07,2045.07
0416120040,RESSECÇÃO DE LESÃO NÃO PALPÁVEL DE MAMA COM MARCAÇÃO EM ONCOLOGIA (POR MAMA),06,SIH,ATUA,1498.64,1498.64,1498.64
0416120059,SEGMENTECTOMIA/QUADRANTECTOMIA/SETORECTOMIA DE MAMA EM ONCOLOGIA,06,SIH,ATUA,1913.83,1913.83,1913.83
0416130011,EXTIRPACAO DE TUMOR DA FARINGE EM ONCOLOGIA,06,SIH,2012,740,740,740
0416130020,EXTIRPACAO DE TUMOR DO CAVUM EM ONCOLOGIA,06,SIH,2012,1089.97,1089.97,1089.97
0416130038,LARINGECTOMIA PARCIAL EM ONCOLOGIA,06,SIH,2012,1089.98,1089.98,1089.98
0416130046,LARINGECTOMIA TOTAL C/ ESVAZIAMENTO CERVICAL EM ONCOLOGIA,06,SIH,2012,2985.99,2985.99,2985.99
0416130054,LARINGECTOMIA TOTAL EM ONCOLOGIA,06,SIH,2012,2548.95,2548.95,2548.95
0416130062,MANDIBULECTOMIA PELVI-GLOSO EM ONCOLOGIA,06,SIH,2012,3787.07,3787.07,3787.07
0417010010,ANESTESIA OBSTETRICA P/ CESARIANA,06,SP,ATUA,61.18,61.18,61.18
0417010028,ANALGESIA OBSTETRICA P/ PARTO NORMAL,06,SP,ATUA,48.3,48.3,48.3
0417010036,ANESTESIA OBSTETRICA P/CESARIANA EM GESTACAO DE ALTO RISCO,06,SP,ATUA,96.6,96.6,96.6
0417010044,ANESTESIA GERAL,06,SP,ATUA,84,84,84
0417010052,ANESTESIA REGIONAL,06,SIA,ATUA,22.27,22.27,22.27
0417010060,SEDACAO,06,SIA,ATUA,15.15,15.15,15.15
0418010013,CONFECCAO DE FISTULA ARTERIO-VENOSA C/ ENXERTIA DE POLITETRAFLUORETILENO (PTFE),04,SIA,ATUA,1453.85,1453.85,1453.85
0418010021,CONFECCAO DE FISTULA ARTERIO-VENOSA C/ ENXERTO AUTOLOGO,04,SIA,ATUA,685.53,685.53,685.53
0418010030,CONFECCAO DE FISTULA ARTERIO-VENOSA P/ HEMODIALISE,04,SIA,ATUA,600,600,600
0418010048,IMPLANTE DE CATETER DE LONGA PERMANÊNCIA P/ HEMODIALISE,04,SIA,ATUA,200,200,200
0418010056,IMPLANTE DE CATETER DUPLO LUMEN NA IRA (INCLUI CATETER),06,SIH,ATUA,163.89,163.89,163.89
0418010064,IMPLANTE DE CATETER DUPLO LUMEN P/HEMODIALISE,04,SIA,ATUA,115.81,115.81,115.81
0418010072,IMPLANTE DE CATETER TENCKHOFF OU SIMILAR DE LONGA PERMANÊNCIA NA IRA (INCLUI CATETER),06,SIH,ATUA,206.8,206.8,206.8
0418010080,IMPLANTE DE CATETER TIPO TENCKHOFF OU SIMILAR P/ DPA/DPAC,04,SIA,ATUA,400,400,400
0418010099,IMPLANTE DE CATETER TIPO TENCKOFF OU SIMILAR P/DPI,04,SIA,ATUA,110.29,110.29,110.29
0418020019,INTERVENCAO EM FISTULA ARTERIO-VENOSA,04,SIA,ATUA,600,600,600
0418020027,LIGADURA DE FISTULA ARTERIO-VENOSA,04,SIA,ATUA,600,600,600
0418020035,RETIRADA DE CATETER TIPO TENCKHOFF / SIMILAR DE LONGA PERMANÊNCIA,04,SIA,ATUA,400,400,400
0501010017,COLETA DE SANGUE EM HEMOCENTRO P/ EXAMES DE HISTOCOMPATIBILIDADE (CADASTRO DE DOADOR NO REDOME),04,SIA,ATUA,27.5,27.5,27.5
0501010025,IDENTIFICACAO DE DOADOR APARENTADO DE CELULAS-TRONCO HEMATOPOETICAS 1A FASE (POR DOADOR TIPADO),04,SIA,ATUA,150,496.94,496.94
0501010033,IDENTIFICACAO DE DOADOR APARENTADO DE CELULAS-TRONCO HEMATOPOETICAS 2A FASE (POR DOADOR TIPADO),04,SIA,ATUA,225,225,#NULL!
0501010041,IDENTIFICACAO DE DOADOR APARENTADO DE CELULAS-TRONCO HEMATOPOETICAS 3A FASE (POR DOADOR TIPADO),04,SIA,ATUA,650,650,#NULL!
0501010050,IDENTIFICACAO DE DOADOR VOLUNTÁRIO DE CÉLULAS TRONCO HEMATOPOÉTICAS PARA CADASTRO NO REDOME (POR DOADOR TIPADO),04,SIA,ATUA,375,1030,1030
0501010068,ENTIFICACAO DE DOADOR NAO APARENTADO DE CELULAS-TRONCO HEMATOPOETICAS (POR DOADOR TIPADO),04,SIA,ATUA,650,550,550
0501010076,CONFIRMAÇÃO DE IDENTIFICAÇÃO DE DOADOR NÃO APARENTADO DE CÉLULAS TRONCO HEMATOPOÉTICAS (POR DOADOR TIPADO),04,SIA,ATUA,225,1030,1030
0501010084,IDENTIFICACAO DE DOADOR VOLUNTARIO DE CELULAS TRONCO HEMATOPOETICA DE DOADORES CADASTRADOS NO REDOME/INCA- COMPLEMENTACAO DA 2ª FASE,04,SIA,ATUA,150,150,#NULL!
0501010092,CONFIRMACAO DE TIPIFICACAO DE DOADOR NÃO APARENTADO DE CÉLULAS TRONCO HEMATOPOÉTICAS (POR DOADOR TIPADO),04,SIA,ATUA,1300,375,375
0501010106,IDENTIFICAÇÃO DE DOADOR APARENTADO DE CÉLULAS TRONCO HEMATOPOETICAS 2ª FASE (POR DOADOR TIPADO),04,SIA,ATUA,#NULL!,1300,1300
0501020012,IDENTIFICACAO DE RECEPTOR DE CELULAS-TRONCO HEMATOPOETICAS 1A FASE,04,SIA,ATUA,375,375,#NULL!
0501020020,IDENTIFICACAO DE RECEPTOR DE CELULAS-TRONCO HEMATOPOETICAS 2A FASE,04,SIA,ATUA,650,650,#NULL!
0501020039,CONFIRMAÇAO DE IDENTIFICAÇÃO DE RECEPTOR DE CÉLULAS TRONCO HEMATOPOÉTICAS,04,SIA,ATUA,1300,1300,1300
0501020047,IDENTIFICAÇÃO/CONFIRMAÇÃO DE RECEPTOR DE CÉLULAS TRONCO HEMATOPOÉTICAS,04,SIA,ATUA,#NULL!,496.94,496.94
0501030018,"COLETA, ACONDICIONAMENTO E TRANSPORTE INTERNACIONAL DE CELULAS-TRONCO HEMATOPOIETICAS DE MEDULA OSSEA P/ TRANSPLANTE",04,SIA,ATUA,48000,48000,48000
0501030026,"FORNECIMENTO, ACONDICIONAMENTO E TRANSPORTE INTERNACIONAL DE CELULAS-TRONCO HEMATOPOETICAS DE CORDAO UMBILICAL P/ TRANSPLANTE",04,SIA,ATUA,26000,26000,26000
0501030034,"FORNECIMENTO, ACONDICIONAMENTO E TRANSPORTE INTERNACIONAL DE LINFOCITOS DE DOADOR NAO APARENTADO P/ TRANSPLANTE",04,SIA,ATUA,10000,10000,10000
0501030042,IDENTIFICACAO INTERNACIONAL DE DOADOR NAO APARENTADO DE CELULAS-TRONCO HEMATOPOETICAS 1A FASE (POR DOADOR TIPADO),04,SIA,ATUA,400,400,400
0501030050,IDENTIFICACAO INTERNACIONAL DE DOADOR NAO APARENTADO DE CELULAS-TRONCO HEMATOPOETICAS 2A FASE (POR DOADOR TIPADO),04,SIA,ATUA,1200,1200,1200
0501030069,COLETA E ACONDICIONAMENTO DE MEDULA OSSEA NO BRASIL PARA TRANSPLANTE AUTOGENICO OU DE DOADOR APARENTADO OU NAO APARENTADO,04,SIH,ATUA,4922.47,4922.47,4922.47
0501030077,"MOBILIZAÇÃO, COLETA E ACONDICIONAMENTO DE CELULAS TRONCO HEMATOPOETICAS DE SANGUE PERIFERICO NO BRASIL PARA TRANSPLANTE AUTOGENICO OU DE DOADOR APARENTADO OU NAO APARENTADO",04,SIA,ATUA,2461.24,2461.24,2461.24
0501030085,TRANSPORTE DE MEDULA OSSEA OU DE CELULAS TRONCO HEMATOPOETICAS DE SANGUE PERIFERICO NO BRASIL DE DOADOR NAO APARENTADO,04,SIA,ATUA,1000,1000,1000
0501030093,PROCESSAMENTO DE CRIOPRESEVAÇÃO DE MEDULA OSSEA OU DE CELULAS TRONCO HEMATOPOETICAS DE SANGUE PERIFERICO NO BRASIL PARA TRANSPLANTE AUTOGENICO,04,SIA,ATUA,2000,2000,2000
0501030107,FORNECIMENTO E ACONDICIONAMENTO E TRANSPORTE NO BRASIL DE LINFOCITOS DE DOADOR NAO APARENTADO,04,SIA,ATUA,3461.24,3461.24,3461.24
0501030115,"COLETA, IDENTIFICAÇÃO, TESTES DE SEGURANÇA, PROCESSAMENTO, ARMAZENAGEM E FORNECIMENTO DE CELULAS TRONCO HEMATOPOETICAS DE CORDAO UMBILICAL E PLACENTARIO",04,SIA,ATUA,3411.18,3411.18,3411.18
0501030123,TRANPORTE DE UNIDADE DE CELULAS TRONCO HEMATOPOETICAS DE SANGUE DE CORDAO UMBILICAL E PLACENTARIO NO BRASIL,04,SIA,ATUA,2200,2200,2200
0501040013,AUTO-PROVA CRUZADA EM RECEPTOR DE RIM (AUTO CROSS-MATCH),04,SIA,ATUA,45.51,281.51,281.51
0501040021,IDENTIFICACAO DE DOADOR FALECIDO DE RIM / PANCREAS E RIM-PANCREAS,04,SIA,ATUA,350,350,#NULL!
0501040030,IDENTIFICACAO DE DOADOR VIVO DE RIM 1A FASE (POR DOADOR TIPADO),04,SIA,ATUA,150,150,#NULL!
0501040048,IDENTIFICACAO DE DOADOR VIVO DE RIM 2A FASE (POR DOADOR TIPADO),04,SIA,ATUA,200,200,#NULL!
0501040056,PROVA CRUZADA EM DOADOR VIVO CONTRA LINFOCITOS T OU B C/ ABSORCAO DE PLAQUETAS (CROSS MATCH),04,SIA,ATUA,75.85,75.85,#NULL!
0501040064,PROVAS CRUZADAS EM RECEPTORES DE DOADORES FALECIDOS (CROSS MATCH),04,SIA,ATUA,300,566.8,566.8
0501040072,PROVAS CRUZADAS EM DOADOR VIVO DE RIM (CROSS MATCH),04,SIA,ATUA,300,300,#NULL!
0501040080,IDENTIFICAÇÃO DE DOADOR FALECIDO DE ÓRGÃOS,04,SIA,ATUA,#NULL!,928,928
0501040099,IDENTIFICAÇÃO DE DOADOR VIVO DE RIM- (POR DOADOR TIPADO),04,SIA,ATUA,#NULL!,696.94,696.94
0501040102,PROVAS CRUZADAS EM DOADORES DE ÓRGÃOS E DE MEDULA ÓSSEA (APARENTADO NÃO IDÊNTICO),04,SIA,ATUA,#NULL!,396.47,396.47
0501050019,AVALIAÇÃO DE REATIVIDADE DO RECEPTOR CONTRA PAINEL EM RECEPTORES HIPERSENSIBILIZADOS DE ÓRGÃOS,04,SIA,ATUA,180,393,393
0501050027,IDENTIFICACAO DE RECEPTOR DE RIM / PANCREAS E RIM-PANCREAS,04,SIA,ATUA,350,350,#NULL!
0501050035,AVALIAÇÃO DE REATIVIDADE EM RECEPTORES NÂO SENSIBILIZADOS,04,SIA,ATUA,180,393,393
0501050043,EXAMES DE PACIENTES EM LISTA DE ESPERA PARA TRANSPLANTES,04,SIA,ATUA,340.2,340.2,340.2
0501050051,IDENTIFICAÇÃO DE RECEPTOR DE ÓRGÃOS,04,SIA,ATUA,#NULL!,496.94,496.94
0501060014,ANGIOGRAFIA CEREBRAL P/ DIAGNOSTICO DE MORTE ENCEFALICA (4 VASOS),04,NÃO,ATUA,0,0,0
0501060022,CINTILOGRAFIA RADIOISOTOPICA CEREBRAL P/ DIAGNOSTICO DE MORTE ENCEFALICA,04,NÃO,ATUA,0,0,0
0501060030,ECO DOPPLER COLORIDO CEREBRAL P/ DIAGNOSTICO DE MORTE ENCEFALICA,04,NÃO,ATUA,0,0,0
0501060049,ELETROENCEFALOGRAMA P/ DIAGNOSTICO DE MORTE ENCEFALICA,04,NÃO,ATUA,0,0,0
0501060057,EXAME COMPLEMENTAR PARA DIAGNÓSTICO DE MORTE ENCEFÁLICA,04,SIH,ATUA,600,600,600
0501070010,SOROLOGIA DE POSSIVEL DOADOR DE CORNEA E ESCLERA,04,SIA,ATUA,60,60,60
0501070028,SOROLOGIA DE POSSIVEL DOADOR DE ORGAO OU TECIDO EXCETO CORNEA,04,SIA,ATUA,186,186,186
0501070036,TIPAGEM SANGUINEA ABO E OUTROS EXAMES HEMATOLOGICOS EM POSSIVEL DOADOR DE ORGAOS,04,SIH,ATUA,15,15,15
0501070044,EXAMES PARA A INCLUSAO EM LISTA DE CANDIDATOS A TRANSPLANTE DE CORACAO,04,SIA,ATUA,2468.83,2468.83,2468.83
0501070052,EXAMES PARA INCLUSÃO EM LISTA DE CANDIDATOS A TRANSPLANTE DE FIGADO,04,SIA,ATUA,318.52,318.52,318.52
0501070060,"EXAMES PARA INCLUSÃO EM LISTA DE CANDIDATOS A TRANSPLANTE DE PÂNCREAS, PULMÃO OU RIM",04,SIA,ATUA,1165.11,1165.11,1165.11
0501070079,EXAMES PARA INCLUSAO EM LISTA DE CANDIDATOS A TRANSPLANTE CONJUGADO DE PANCREAS E RIM,04,SIA,ATUA,1901.59,1901.59,1901.59
0501070087,"EXAMES PARA INVESTIGAÇÃO CLÍNICA NO DOADOR VIVO DE RIM, FIGADO OU PULMÃO - 1ª FASE.",04,SIA,ATUA,184.5,184.5,184.5
0501070095,EXAMES PARA INVESTIGAÇÃO CLÍNICA NO DOADOR VIVO DE FIGADO-COMPLEMENTAÇÃO DA 1ª FASE.,04,SIA,ATUA,257.85,257.85,257.85
0501070109,EXAMES PARA INVESTIGAÇÃO CLÍNICA NO DOADOR VIVO DE RIM- COMPLEMENTAÇÃO DA 1ª FASE.,04,SIA,ATUA,598.02,598.02,598.02
0501070117,EXAMES PARA INVESTIGAÇÃO CLÍNICA NO DOADOR VIVO DE PULMÃO-COMPLEMENTAÇÃO DA 1ª FASE.,04,SIA,ATUA,221.82,221.82,221.82
0501080015,BIOPSIA E EXAME ANATOMO-CITOPATOLOGICO EM PACIENTE TRANSPLANTADO,04,SIA,ATUA,35,35,35
0501080023,CONTAGEM DE CD4/CD3 EM PACIENTE TRANSPLANTADO,04,SIA,ATUA,75,75,75
0501080031,DOSAGEM DE CICLOSPORINA (EM PACIENTE TRANSPLANTADO),04,SIA,ATUA,52.33,52.33,52.33
0501080040,DOSAGEM DE SIROLIMO (EM PACIENTE TRANSPLANTADO),04,SIA,ATUA,52.33,52.33,52.33
0501080058,DOSAGEM DE TACROLIMO (EM PACIENTE TRANSPLANTADO),04,SIA,ATUA,52.33,52.33,52.33
0501080066,EXAMES DE RADIOLOGIA EM PACIENTE TRANSPLANTADO,04,SIA,ATUA,25,25,25
0501080074,EXAMES MICROBIOLOGICOS EM PACIENTE TRANSPLANTADO,04,SIA,ATUA,15,15,15
0501080082,SOROLOGIA EM PACIENTE TRANSPLANTADO,04,SIH,ATUA,20,20,20
0501080090,ULTRASSONOGRAFIA DE ORGAO TRANSPLANTADO,04,SIA,ATUA,12,12,12
0501080104,DOSAGEM DE EVEROLIMO (EM PACIENTE TRANSPLANTADO),04,SIA,ATUA,52.33,52.33,52.33
0502010010,AVALIACAO CLINICA DE MORTE ENCEFALICA EM MAIOR DE 2 ANOS,04,SIH,ATUA,215,215,215
0502010029,AVALIAÇÃO CLINICA DE MORTE ENCEFÁLICA EM MENOR DE 2 ANOS,04,SIH,ATUA,275,275,275
0503010014,AÇÕES RELACIONADAS A DOAÇÃO DE ÓRGÃOS E TECIDOS PARA TRANSPLANTE,04,NÃO,ATUA,0,0,0
0503010022,AÇÕES RELACIONADAS A DOAÇÃO DE ÓRGÃOS E TECIDOS REALIZADAS POR EQUIPE DE OUTRO ESTABELECIMENTO DE SAUDE,04,NÃO,ATUA,0,0,0
0503010030,CAPTACÃO DE ORGAO EFETIVAMENTE TRANSPLANTADO,04,SIH,2010,260,260,260
0503020010,HEPATECTOMIA PARCIAL P/ TRANSPLANTE (DOADOR VIVO),04,SIH,ATUA,7384,7384,7384
0503020028,NEFROURETERECTOMIA UNILATERAL P/ TRANSPLANTE,04,SIH,ATUA,2123.6,2123.6,2123.6
0503030015,MANUTENCAO HEMODINAMICA DE POSSIVEL DOADOR E TAXA DE SALA P/ RETIRADA DE ORGAOS,04,SIH,ATUA,900,900,900
0503030023,RETIRADA DE CORAÇÃO (PARA TRANSPLANTE),04,SP,ATUA,1170,1170,1170
0503030031,RETIRADA DE CORACAO P/ PROCESSAMENTO DE VALVULA / TUBO VALVADO P/ TRANSPLANTE,04,SP,ATUA,260,260,260
0503030040,RETIRADA DE FÍGADO (PARA TRANSPLANTE),04,SP,ATUA,2340,2340,2340
0503030058,RETIRADA DE GLOBO OCULAR UNI / BILATERAL (P/ TRANSPLANTE),04,SIA,ATUA,322.38,322.38,322.38
0503030066,RETIRADA DE PÂNCREAS (PARA TRANSPLANTE),04,SP,ATUA,2340,2340,2340
0503030074,RETIRADA DE PULMÕES (PARA TRANSPLANTE),04,SP,ATUA,2340,2340,2340
0503030082,RETIRADA UNI / BILATERAL DE RIM (PARA TRANSPLANTE) - DOADOR FALECIDO,04,SP,ATUA,1170,1170,1170
0503030090,RETIRADA DE TECIDO ÓSTEO -FASCIO-CONDRO- LIGAMENTOSO,04,SIH,ATUA,1170,1170,1170
0503030104,RETIRADA DE PELE PARA TRANSPLANTE,04,SIH,ATUA,1170,1170,1170
0503040010,COORDENACAO DE SALA CIRURGICA P/ RETIRADA DE ORGAOS E TECIDOS P/ TRANSPLANTE,04,SIH,ATUA,400,400,400
0503040029,DESLOCAMENTO INTERESTADUAL DE EQUIPE PROFISSIONAL P/ RETIRADA DE ORGAOS,04,SP,ATUA,900,900,900
0503040037,DESLOCAMENTO DE EQUIPE PROFISSIONAL P/ RETIRADA DE ORGAOS - INTERMUNICIPAL,04,SP,ATUA,450,450,450
0503040045,DIARIA DE UNIDADE DE TERAPIA INTENSIVA DE PROVÁVEL DOADOR DE ÓRGÃOS,04,SIH,ATUA,508.63,508.63,508.63
0503040053,ENTREVISTA FAMILIAR P/ DOAÇÃO DE ORGAOS DE DOADORES EM MORTE ENCEFÁLICA,04,SIH,ATUA,420,420,420
0503040061,ENTREVISTA FAMILIAR PARA DOAÇÃO DE TECIDOS DE DOADORES COM CORAÇÃO PARADO,04,SIA,ATUA,420,420,420
0503040088,CAPTAÇÃO DE ÓRGÃO EFETIVAMENTE TRANSPLANTADO,04,SIH,ATUA,260,260,260
0504010018,CONTAGEM DE CELULAS ENDOTELIAIS DA CORNEA,04,SIA,ATUA,64.8,64.8,64.8
0504010026,PROCESSAMENTO DE CORNEA / ESCLERA,04,NÃO,ATUA,0,0,0
0504010034,SEPARACAO E AVALIACAO BIOMICROSCOPICA DA CORNEA,04,SIA,ATUA,367.2,367.2,367.2
0504020013,PROCESSAMENTO DE TECIDO MUSCULOESQUELETICO (05-25 GR),04,SIH,ATUA,290,290,290
0504020021,PROCESSAMENTO DE TECIDO MUSCULOESQUELETICO (101-200 GR),04,SIH,ATUA,1550,1550,1550
0504020030,PROCESSAMENTO DE TECIDO MUSCULOESQUELETICO (201-300 GR),04,SIH,ATUA,2210,2210,2210
0504020048,PROCESSAMENTO DE TECIDO MUSCULOESQUELETICO (26-50 GR),04,SIH,ATUA,590,590,590
0504020056,PROCESSAMENTO DE TECIDO MUSCULOESQUELETICO (51-100 GR),04,SIH,ATUA,1140,1140,1140
0504030019,PROCESSAMENTO DE TUBO VALVADO CARDIACO HUMANO,04,SIH,2018,3626.5,3626.5,3626.5
0504030027,PROCESSAMENTO DE VALVULA CARDIACA HUMANA,04,SIH,ATUA,3691.5,3691.5,3691.5
0504040014,PROCESSAMENTO DE PELE EM GLICEROL (ATÉ 1000 CM²) PARA ADULTO,04,SIA,ATUA,259.13,259.13,259.13
0504040022,PROCESSAMENTO DE PELE EM GLICEROL ( ATÉ 500 CM²) INFANTIL,04,SIA,ATUA,259.13,259.13,259.13
0505010011,TRANSPLANTE ALOGÊNICO DE CÉLULAS-TRONCO HEMATOPOÉTICAS DE MEDULA ÓSSEA - APARENTADO,04,SIH,ATUA,54939.27,54939.27,54939.27
0505010020,TRANSPLANTE ALOGÊNICO DE CÉLULAS-TRONCO HEMATOPOÉTICAS DE MEDULA ÓSSEA - NÃO APARENTADO,04,SIH,ATUA,71602.25,71602.25,71602.25
0505010038,TRANSPLANTE ALOGÊNICO DE CÉLULAS-TRONCO HEMATOPOÉTICAS DE SANGUE DE CORDÃO UMBILICAL DE APARENTADO,04,SIH,ATUA,58372.97,58372.97,58372.97
0505010046,TRANSPLANTE ALOGÊNICO DE CÉLULAS-TRONCO HEMATOPOÉTICAS DE SANGUE DE CORDÃO UMBILICAL DE NÃO APARENTADO,04,SIH,ATUA,71602.25,71602.25,71602.25
0505010054,TRANSPLANTE ALOGÊNICO DE CÉLULAS-TRONCO HEMATOPOÉTICAS DE SANGUE PERIFÉRICO - APARENTADO,04,SIH,ATUA,54939.27,54939.27,54939.27
0505010062,TRANSPLANTE ALOGÊNICO DE CÉLULAS-TRONCO HEMATOPOÉTICAS DE SANGUE PERIFÉRICO - NÃO APARENTADO,04,SIH,ATUA,71602.25,71602.25,71602.25
0505010070,TRANSPLANTE AUTOGENICO DE CELULAS-TRONCO HEMATOPOETICAS DE MEDULA OSSEA -,04,SIH,ATUA,22968.78,22968.78,22968.78
0505010089,TRANSPLANTE AUTOGENICO DE CELULAS-TRONCO HEMATOPOETICAS DE SANGUE PERIFERICO -,04,SIH,ATUA,22968.78,22968.78,22968.78
0505010097,TRANSPLANTE DE CORNEA,04,SIA,ATUA,2070,2070,2070
0505010100,TRANSPLANTE DE CORNEA (EM CIRURGIAS COMBINADAS),04,SIA,ATUA,1129.3,1129.3,#NULL!
0505010119,TRANSPLANTE DE CORNEA (EM REOPERACOES),04,SIA,ATUA,1129.3,1129.3,#NULL!
0505010127,TRANSPLANTE DE ESCLERA,04,SIA,ATUA,776.8,776.8,776.8
0505010135,TRANSPLANTE DE CÓRNEA (EM CIRURGIAS COMBINADAS OU EM REOPERAÇÕES),04,SIA,ATUA,#NULL!,#NULL!,2070
0505020017,PARTICIPACAO DE EQUIPE NEFROLOGICA EM TRANSPLANTE RENAL DE DOADOR FALECIDO,04,NÃO,ATUA,0,0,0
0505020025,PARTICIPACAO DE EQUIPE NEFROLOGICA EM TRANSPLANTE RENAL DE DOADOR VIVO,04,NÃO,ATUA,0,0,0
0505020033,PARTICIPACAO DE EQUIPE NEFROLOGICA EM TRANSPLANTE SIMULTANEO DE PANCREAS E RIM,04,NÃO,ATUA,0,0,0
0505020041,TRANSPLANTE DE CORACAO,04,SIH,ATUA,37052.69,37052.69,37052.69
0505020050,TRANSPLANTE DE FIGADO (ORGAO DE DOADOR FALECIDO),04,SIH,ATUA,68838.89,68838.89,68838.89
0505020068,TRANSPLANTE DE FIGADO (ORGAO DE DOADOR VIVO),04,SIH,ATUA,68803.27,68803.27,68803.27
0505020076,TRANSPLANTE DE PANCREAS,04,SIH,ATUA,38093.98,38093.98,38093.98
0505020084,TRANSPLANTE DE PULMAO UNILATERAL,04,SIH,ATUA,44485.1,44485.1,44485.1
0505020092,TRANSPLANTE DE RIM (ORGAO DE DOADOR FALECIDO),04,SIH,ATUA,27622.67,27622.67,27622.67
0505020106,TRANSPLANTE DE RIM (ORGAO DE DOADOR VIVO),04,SIH,ATUA,21238.82,21238.82,21238.82
0505020114,TRANSPLANTE SIMULTANEO DE PANCREAS E RIM,04,SIH,ATUA,54986.45,54986.45,54986.45
0505020122,TRANSPLANTE DE PULMÃO BILATERAL,04,SIH,ATUA,64434.67,64434.67,64434.67
0505020130,TRANSPLANTE DE FIGADO EM FEBRE AMARELA,04,SIH,2018,188133.22,188133.22,188133.22
0506010015,ACOMPANHAMENTO DE PACIENTE POS-TRANSPLANTE DE CORNEA,04,SIA,ATUA,115,115,115
0506010023,ACOMPANHAMENTO DE PACIENTE POS-TRANSPLANTE DE RIM FIGADO CORACAO PULMAO CELULAS-TRONCO HEMATOPOETICAS E/OU PANCREAS,04,SIA,ATUA,135,135,135
0506010031,"ACOMPANHAMENTO DE DOADOR VIVO POS-DOAÇAO DE FIGADO, PULMAO OU RIM",04,SIA,ATUA,135,135,135
0506010040,ACOMPANHAMENTO DE PACIENTES NO PRÉ TRANSPLANTE DE ÓRGÃOS,04,SIA,ATUA,135,135,135
0506010058,AVALIAÇÃO DO POSSÍVEL DOADOR FALECIDO DE ORGÃOS OU TECIDOS PARA TRANSPLANTES,04,SIA,ATUA,215,215,215
0506020010,INTERCORRENCIA POS TRANSPLANTE ALOGÊNICO DE CELULAS-TRONCO HEMATOPOÉTICAS - NAO APARENTADO (HOSPITAL DIA),04,SIH,ATUA,135,135,135
0506020029,INTERCORRENCIA POS-TRANSPLANTE AUTOGENICO DE CELULAS-TRONCO HEMATOPOETICAS (HOSPITAL DIA),04,SIH,ATUA,135,135,135
0506020037,TRATAMENTO DE INTERCORRENCIA POS-TRANSPLANTE ALOGENICO DE CELULAS-TRONCO HEMATOPOETICAS DE APARENTADO (HOSPITAL DIA),04,SIH,ATUA,135,135,135
0506020045,TRATAMENTO DE INTERCORRÊNCIA PÓS-TRANSPLANTE DE ÓRGÃOS / CÉLULAS-TRONCO HEMATOPOÉTICAS,04,SIH,ATUA,135,135,135
0506020053,TRATAMENTO DE INTERCORRÊNCIA PÓS-TRANSPLANTE DE RIM - PÓS TRANSPLANTE CRÍTICO,04,SIH,ATUA,118.05,118.05,118.05
0506020061,TRATAMENTO DE INTERCORRENCIA PÓS TRANSPLANTE DE CORAÇÃO- PÓS TRANSPLANTE CRÍTICO,04,SIH,ATUA,205.84,205.84,205.84
0506020070,TRATAMENTO DE INTERCORRÊNCIA PÓS TRANSPLANTE DE PULMÃO UNI/BILATERAL - PÓS TRANSPLANTE CRÍTICO,04,SIH,ATUA,357.97,357.97,357.97
0506020088,TRATAMENTO DE INTERCORRENCIA PÓS TRANSPLANTE SIMULTANEO DE RIM/PÃNCREAS OU PÂNCREAS ISOLADO- PÓS TRANSPLANTE CRÍTICO,04,SIH,ATUA,305.48,305.48,305.48
0506020096,TRATAMENTO DE INTERCORRENCIA PÓS TRANSPLANTE DE FIGADO- PÓS TRANSPLANTE CRÍTICO,04,SIH,ATUA,382.44,382.44,382.44
0506020100,TRATAMENTO DE INTERCORRENCIA PÓS TRANSPLANTE ALOGÊNICO DE CÉLULAS-TRONCO HEMATOPOÉTICAS- PÓS TRANSPLANTE CRÍTICO,04,SIH,ATUA,397.79,397.79,397.79
0506020118,TRATAMENTO DE INTERCORRENCIA PÓS TRANSPLANTE AUTOLÓGO DE CÉLULAS-TRONCO HEMATOPOÉTICAS- PÓS TRANSPLANTE CRÍTICO,04,SIH,ATUA,127.6,127.6,127.6
0506020126,TRATAMENTO DE INTERCORRÊNCIA PÓS-TRANSPLANTE DE FÍGADO EM FEBRE AMARELA - PÓS -TRANSPLANTE CRÍTICO,04,SIH,2018,382.44,382.44,382.44
0601010019,ADALIMUMABE (A) 40 MG INJETAVEL- SERINGA PREENCHIDA (POR TRATAMENTO MENSAL),02,SIA,2010,2838.83,2838.83,2838.83
0601010027,ETANERCEPTE (A)25 MG INJETAVEL -FRASCO-AMPOLA (POR TRATAMENTO MENSAL),02,SIA,2010,2838.83,2838.83,2838.83
0601010035,INFLIXIMABE (A)10 MG/ML  10 ML INJETAVEL  (FRASCO-AMPOLA- POR TRATAMENTO MENSAL),02,SIA,2010,2838.83,2838.83,2838.83
0601010043,INFLIXIMABE 10 MG/ML INJETAVEL (POR FRASCO-AMPOLA 10 ML),02,SIA,2010,1470.56,1470.56,1470.56
0601010051,ETANERCEPTE 50MG INJETAVEL- FRASCO AMPOLA (POR TRATAMENTO MENSAL),02,SIA,2010,2838.83,2838.83,2838.83
0601020014,RILUZOL 50 MG (POR COMPRIMIDO),02,SIA,2010,11.89,11.89,11.89
0601030010,HIDROXIUREIA 500 MG (POR CAPSULA),02,SIA,2010,0.72,0.72,0.72
0601030028,SACARATO DE HIDROXIDO FERRICO 100 MG INJETAVEL (POR FRASCO DE 5 ML),02,SIA,2010,3.72,3.72,3.72
0601040015,ALFAEPOETINA 1.000 UI INJETAVEL (POR FRASCO-AMPOLA),02,SIA,2010,4.17,4.17,4.17
0601040023,ALFAEPOETINA 10.000 UI INJETAVEL (POR FRASCO-AMPOLA),02,SIA,2010,22.54,22.54,22.54
0601040031,ALFAEPOETINA 2.000 UI INJETAVEL (POR FRASCO-AMPOLA),02,NÃO,ATUA,0,0,0
0601040040,ALFAEPOETINA 3.000 UI INJETAVEL (POR FRASCO-AMPOLA),02,SIA,2010,3.85,3.85,3.85
0601040058,ALFAEPOETINA 4.000 UI INJETAVEL (POR FRASCO-AMPOLA),02,NÃO,ATUA,0,0,0
0601050010,BECLOMETASONA (C) 200 MCG (POR CAPSULA INALANTE),02,SIA,2010,0.12,0.12,0.12
0601050029,BECLOMETASONA (C) 200 MCG PO INALANTE (POR FRASCO  DE 100 DOSES),02,SIA,2010,10.8,10.8,10.8
0601050037,BECLOMETASONA (C) 250 MCG SPRAY (POR FRASCO  DE 200 DOSES),02,SIA,2010,23.35,23.35,23.35
0601050045,BECLOMETASONA (C) 400 MCG  (POR CAPSULA INALANTE),02,SIA,2010,0.14,0.14,0.14
0601050053,BECLOMETASONA (C) 400 MCG PO INALANTE (POR FRASCO DE 100 DOSES),02,SIA,2010,13.95,13.95,13.95
0601050061,BUDESONIDA (C) 200 MCG (POR CAPSULA INALANTE),02,SIA,2010,0.21,0.21,0.21
0601050070,BUDESONIDA (C) 200 MCG PO INALANTE OU AEROSSOL BUCAL (POR FRASCO C/ 100 DOSES),02,SIA,2010,10.93,10.93,10.93
0601050088,FENOTEROL (B) 200 MCG AEROSSOL (POR FRASCO DE 300 DOSES),02,SIA,2010,8.05,8.05,8.05
0601050096,FORMOTEROL (D) 12 MCG (POR CAPSULA INALANTE),02,SIA,2010,0.44,0.44,0.44
0601050100,FORMOTEROL (D) 12 MCG PO INALANTE (POR FRASCO DE 60 DOSES),02,SIA,2010,19.24,19.24,19.24
0601050118,FORMOTEROL 12 MCG + BUDESONIDA 400 MCG  (POR CAPSULA INALANTE),02,SIA,2010,0.55,0.55,0.55
0601050126,FORMOTEROL 12 MCG + BUDESONIDA 400 MCG PO INALANTE (POR FRASCO DE 60 DOSES),02,SIA,2010,32.8,32.8,32.8
0601050134,FORMOTEROL 6 MCG + BUDESONIDA 200 MCG PO INALANTE (POR FRASCO DE 60 DOSES),02,SIA,2010,31.6,31.6,31.6
0601050142,FORMOTEROL 6MCG + BUDESONIDA 200 MCG (POR CAPSULA INALANTE),02,SIA,2010,0.53,0.53,0.53
0601050150,SALBUTAMOL (B)100 MCG AEROSSOL (POR FRASCO DE 200 DOSES),02,SIA,2010,9.2,9.2,9.2
0601050169,SALMETEROL (D) 50 MCG PO INALANTE OU AEROSSOL BUCAL (POR FRASCO DE 60 DOSES),02,SIA,2010,30.57,30.57,30.57
0601060016,CIPROFLOXACINA 250 MG (POR COMPRIMIDO),02,SIA,2010,0.14,0.14,0.14
0601060024,CIPROFLOXACINA 500 MG (POR COMPRIMIDO),02,SIA,2010,0.13,0.13,0.13
0601070011,GABAPENTINA 300 MG (POR CAPSULA),02,SIA,2010,0.59,0.59,0.59
0601070020,GABAPENTINA 400 MG (POR CAPSULA),02,SIA,2010,0.77,0.77,0.77
0601070038,LAMOTRIGINA 100 MG (POR COMPRIMIDO),02,SIA,2010,0.35,0.35,0.35
0601070046,LAMOTRIGINA 25 MG (POR COMPRIMIDO),02,SIA,2010,0.12,0.12,0.12
0601070054,TOPIRAMATO 100 MG (POR COMPRIMIDO),02,SIA,2010,2.67,2.67,2.67
0601070062,TOPIRAMATO 25 MG (POR COMPRIMIDO),02,SIA,2010,0.7,0.7,0.7
0601070070,TOPIRAMATO 50 MG (POR COMPRIMIDO),02,SIA,2010,1.47,1.47,1.47
0601070089,VIGABATRINA 500 MG (POR COMPRIMIDO),02,SIA,2010,1.18,1.18,1.18
0601080017,CLOROQUINA (E) 150 MG (POR COMPRIMIDO),02,SIA,2010,0.04,0.04,0.04
0601080025,HIDROXICLOROQUINA (E) 400 MG (POR COMPRIMIDO),02,SIA,2010,0.75,0.75,0.75
0601080033,METILPREDNISOLONA 500 MG INJETAVEL (POR AMPOLA),02,SIA,2010,15.82,15.82,15.82
0601090012,MESALAZINA 1 G + DILUENTE 100 ML (ENEMA) -POR DOSE,02,SIA,2010,4.7,4.7,4.7
0601090020,MESALAZINA 1000 MG (POR SUPOSITORIO),02,SIA,2010,5.22,5.22,5.22
0601090039,MESALAZINA 250 MG (POR SUPOSITORIO),02,SIA,2010,0.86,0.86,0.86
0601090047,MESALAZINA 3 G + DILUENTE 100 ML (ENEMA) - POR DOSE,02,SIA,2010,8.62,8.62,8.62
0601090055,MESALAZINA 400 MG (POR COMPRIMIDO),02,SIA,2010,0.3,0.3,0.3
0601090063,MESALAZINA 500 MG (POR COMPRIMIDO),02,SIA,2010,0.93,0.93,0.93
0601090080,MESALAZINA 800 MG - POR COMPRIMIDO,02,SIA,2010,0.54,0.54,0.54
0601090098,SULFASSALAZINA 500 MG (POR COMPRIMIDO),02,SIA,2010,0.37,0.37,0.37
0601090101,MESALAZINA 500 MG (POR SUPOSITORIO),02,SIA,2010,1.28,1.28,1.28
0601100018,AMANTADINA 100 MG (POR COMPRIMIDO),02,SIA,2010,0.22,0.22,0.22
0601100026,BIPERIDENO 2 MG (POR COMPRIMIDO),02,SIA,2010,0.06,0.06,0.06
0601100034,BIPERIDENO 4 MG (POR COMPRIMIDO),02,SIA,2010,0.27,0.27,0.27
0601100042,ENTACAPONA (F) 200 MG (POR COMPRIMIDO),02,SIA,2010,1.98,1.98,1.98
0601100050,LEVODOPA 100 MG + BENSERAZIDA 25 MG (POR CAPSULA OU COMPRIMIDO),02,SIA,2010,0.43,0.43,0.43
0601100069,LEVODOPA 200 MG + BENSERAZIDA 50 MG (POR COMPRIMIDO),02,SIA,2010,0.8,0.8,0.8
0601100077,LEVODOPA 200 MG + CARBIDOPA 50 MG (POR CAPSULA OU COMPRIMIDO),02,SIA,2010,0.18,0.18,0.18
0601100085,LEVODOPA 250MG + CARBIDOPA 25 MG (POR COMPRIMIDO),02,SIA,2010,0.18,0.18,0.18
0601100093,"PRAMIPEXOL 0,125 MG (POR COMPRIMIDO)",02,SIA,2010,0.44,0.44,0.44
0601100107,"PRAMIPEXOL 0,25 MG (POR COMPRIMIDO)",02,SIA,2010,0.96,0.96,0.96
0601100115,PRAMIPEXOL 1 MG (POR COMPRIMIDO),02,SIA,2010,2.85,2.85,2.85
0601100123,SELEGILINA 10 MG (POR COMPRIMIDO),02,SIA,2010,0.84,0.84,0.84
0601100131,SELEGILINA 5 MG (POR COMPRIMIDO),02,SIA,2010,0.28,0.28,0.28
0601100140,TOLCAPONA (F) 100 MG (POR COMPRIMIDO),02,SIA,2010,2.04,2.04,2.04
0601100158,TOLCAPONA (F) 200 MG (POR COMPRIMIDO),02,SIA,2010,3.36,3.36,3.36
0601100166,TRIEXIFENIDILA 5 MG (POR COMPRIMIDO),02,SIA,2010,0.1,0.1,0.1
0601110013,CLOZAPINA 100 MG (POR COMPRIMIDO),02,SIA,2010,1.55,1.55,1.55
0601110021,CLOZAPINA 25 MG (POR COMPRIMIDO),02,SIA,2010,0.37,0.37,0.37
0601110030,OLANZAPINA (G) 10 MG (POR COMPRIMIDO),02,SIA,2010,9.07,9.07,9.07
0601110048,OLANZAPINA (G) 5 MG (POR COMPRIMIDO),02,SIA,2010,4.54,4.54,4.54
0601110056,QUETIAPINA  (G) 100 MG (POR COMPRIMIDO),02,SIA,2010,3.5,3.5,3.5
0601110064,QUETIAPINA  (G) 25 MG (POR COMPRIMIDO),02,SIA,2010,1.05,1.05,1.05
0601110072,QUETIAPINA (G) 200 MG (POR COMPRIMIDO),02,SIA,2010,6.3,6.3,6.3
0601110080,RISPERIDONA 1 MG (POR COMPRIMIDO),02,SIA,2010,0.08,0.08,0.08
0601110099,RISPERIDONA 2 MG (POR COMPRIMIDO),02,SIA,2010,0.09,0.09,0.09
0601110102,ZIPRASIDONA (G)  80 MG (POR CAPSULA),02,SIA,2010,5.08,5.08,5.08
