0303040220,TRATAMENTO DE ESCLEROSE GENERALIZADA PROGRESSIVA,06,SIH,ATUA,174.84,174.84,174.84
0303040238,TRATAMENTO DE FRATURA DA COLUNA VERTEBRAL C/ LESÃO DA MEDULA ESPINHAL,06,SIH,ATUA,298.42,298.42,298.42
0303040246,TRATAMENTO DE INTERCORRENCIAS DE DOENCAS NEUROMUSCULARES,06,SIH,ATUA,228.44,228.44,228.44
0303040254,TRATAMENTO DE MIASTENIA GRAVE,06,SIH,ATUA,174.84,174.84,174.84
0303040262,TRATAMENTO DE POLINEUROPATIAS,06,SIH,ATUA,359.91,359.91,359.91
0303040270,TRATAMENTO DE POLIRRADICULONEURITE DESMIELINIZANTE AGUDA,06,SIH,ATUA,261.2,261.2,261.2
0303040289,TRATAMENTO DE SURTO DE ESCLEROSE MULTIPLA,06,SIH,ATUA,303.8,303.8,303.8
0303040297,TRATAMENTO DE PROCESSO TOXI-INFECCIOSO DO CEREBRO OU DA MEDULA ESPINHAL,06,SIH,ATUA,261.2,261.2,261.2
0303040300,TRATAMENTO DO ACIDENTE VASCULAR CEREBRAL ISQUÊMICO AGUDO COM USO DE TROMBOLÍTICO,06,SIH,ATUA,1635.55,1635.55,1635.55
0303050012,ACOMPANHAMENTO E AVALIACAO DE GLAUCOMA POR FUNDOSCOPIA E TONOMETRIA,06,SIA,ATUA,17.74,17.74,17.74
0303050020,EXERCICIOS ORTOPTICOS,06,SIA,ATUA,3.27,3.27,3.27
0303050039,TRATAMENTO OFTALMOLÒGICO DE PACIENTE C/ GLAUCOMA BINOCULAR (1ª LINHA ),06,SIA,ATUA,18.66,18.66,18.66
0303050047,TRATAMENTO OFTALMOLÓGICO DE PACIENTE C/ GLAUCOMA BINOCULAR (2ª LINHA),06,SIA,ATUA,79.38,79.38,79.38
0303050055,TRATAMENTO OFTALMOLÓGICO DE PACIENTE C/ GLAUCOMA BINOCULAR (3 ª LINHA),06,SIA,ATUA,127.98,127.98,127.98
0303050063,TRATAMENTO OFTALMOLÓGICO DE PACIENTE C/ GLAUCOMA MONOCULAR (1ª LINHA ),06,SIA,ATUA,12.44,12.44,12.44
0303050071,TRATAMENTO OFTALMOLÓGICO DE PACIENTE COM GLAUCOMA MONOCULAR (2ª LINHA),06,SIA,ATUA,52.92,52.92,52.92
0303050080,TRATAMENTO OFTALMOLÓGICO DE PACIENTE COM GLAUCOMA MONOCULAR (3ª LINHA),06,SIA,ATUA,85.33,85.33,85.33
0303050098,TRATAMENTO OFTALMOLOGICO DE PACIENTE COM GLAUCOMA COM DISPENSAÇÃO DE ACETAZOLAMIDA MONOCULAR OU BINOCULAR,06,SIA,ATUA,93.1,93.1,93.1
0303050101,TRATAMENTO OFTALMOLÓGICO DE PACIENTE COM GLAUCOMA COM DISPENSAÇÃO DE PILOCARPINA MONOCULAR,06,SIA,ATUA,8.93,8.93,8.93
0303050110,TRATAMENTO OFTALMOLÓGICO DE PACIENTE COM GLAUCOMA COM DISPENSAÇÃO DE PILOCARPINA BINOCULAR,06,SIA,ATUA,13.39,13.39,13.39
0303050128,CONSULTA OFTALMOLÓGICA - PROJETO OLHAR BRASIL,04,SIA,2016,21,21,21
0303050136,TRATAMENTO CLÍNICO DE INTERCORRÊNCIAS OFTALMOLÓGICAS,06,SIH,ATUA,229.9,229.9,229.9
0303050144,TRATAMENTO CLÍNICO DE INTERCORRÊNCIAS OFTALMOLÓGICAS DE ORIGEM INFECCIOSA,06,SIH,ATUA,280.27,280.27,280.27
0303050152,TRATAMENTO OFTALMOLÓGICO DE PACIENTE COM GLAUCOMA - 1ª LINHA ASSOCIADA A 2ª LINHA - MONOCULAR,06,SIA,ATUA,65.36,65.36,65.36
0303050160,TRATAMENTO OFTALMOLÓGICO DE PACIENTE COM GLAUCOMA - 1ª LINHA ASSOCIADA A 2ª LINHA - BINOCULAR,06,SIA,ATUA,98.04,98.04,98.04
0303050179,TRATAMENTO OFTALMOLÓGICO DE PACIENTE COM GLAUCOMA - 1ª LINHA ASSOCIADA A 3ª LINHA - MONOCULAR,06,SIA,ATUA,97.77,97.77,97.77
0303050187,TRATAMENTO OFTALMOLÓGICO DE PACIENTE COM GLAUCOMA - 1ª LINHA ASSOCIADA A 3ª LINHA - BINOCULAR,06,SIA,ATUA,146.64,146.64,146.64
0303050195,TRATAMENTO OFTALMOLÓGICO DE PACIENTE COM GLAUCOMA - 2ª LINHA ASSOCIADA A 3ª LINHA - MONOCULAR,06,SIA,ATUA,138.25,138.25,138.25
0303050209,TRATAMENTO OFTALMOLÓGICO DE PACIENTE COM GLAUCOMA - 2ª LINHA ASSOCIADA A 3ª LINHA - BINOCULAR,06,SIA,ATUA,207.36,207.36,207.36
0303050217,"TRATAMENTO OFTALMOLÓGICO DE PACIENTE COM GLAUCOMA MONOCULAR- ASSOCIAÇÃO DE 1ª, 2ª E 3ª LINHAS",06,SIA,ATUA,150.69,150.69,150.69
0303050225,"TRATAMENTO OFTALMOLÓGICO DE PACIENTE COM GLAUCOMA BINOCULAR - ASSOCIAÇÃO 1ª, 2ª E 3ª LINHAS",06,SIA,ATUA,226.02,226.02,226.02
0303050233,TRATAMENTO MEDICAMENTOSO DA DOENÇA DA RETINA I,04,SIA,ATUA,84.72,84.72,84.72
0303050241,TRATAMENTO MEDICAMENTOSO DE DOENÇA DA RETINA II,04,SIA,ATUA,#NULL!,#NULL!,627.28
0303060018,TRATAMENTO DE ANEURISMA DA AORTA,06,SIH,ATUA,292.89,292.89,292.89
0303060026,TRATAMENTO DE ARRITMIAS,06,SIH,ATUA,219.65,219.65,219.65
0303060034,TRATAMENTO DE CARDIOPATIA HIPERTROFICA,06,SIH,ATUA,262.55,262.55,262.55
0303060042,TRATAMENTO DE CARDIOPATIA ISQUEMICA CRONICA,06,SIH,ATUA,246.48,246.48,246.48
0303060050,TRATAMENTO DE CHOQUE ANAFILATICO,06,SIH,ATUA,88.7,88.7,88.7
0303060069,TRATAMENTO DE CHOQUE CARDIOGENICO,06,SIH,ATUA,436.79,436.79,436.79
0303060077,TRATAMENTO DE CHOQUE HIPOVOLEMICO,06,SIH,ATUA,326.43,326.43,326.43
0303060085,TRATAMENTO DE COMPLICACOES CARDIACAS POS-CIRURGIA,06,SIH,ATUA,251.35,251.35,251.35
0303060093,TRATAMENTO DE COMPLICACOES DE DISPOSITIVOS PROTETICOS IMPLANTES E ENXERTOS CARDIACOS E VALVULARES,06,SIH,ATUA,200.72,200.72,200.72
0303060107,TRATAMENTO DE CRISE HIPERTENSIVA,06,SIH,ATUA,189.67,189.67,189.67
0303060115,TRATAMENTO DE DOENCA REUMATICA C/ COMPROMETIMENTO CARDIACO,06,SIH,ATUA,251.35,251.35,251.35
0303060123,TRATAMENTO DE DOENCA REUMATICA S/ CARDITE,06,SIH,ATUA,187.44,187.44,187.44
0303060131,TRATAMENTO DE EDEMA AGUDO DE PULMAO,06,SIH,ATUA,635.03,635.03,635.03
0303060140,TRATAMENTO DE EMBOLIA PULMONAR,06,SIH,ATUA,512.78,512.78,512.78
0303060158,TRATAMENTO DE ENDOCARDITE INFECCIOSA EM PROTESE VALVAR,06,SIH,ATUA,880,880,880
0303060166,TRATAMENTO DE ENDOCARDITE INFECCIOSA EM VALVULA NATIVA,06,SIH,ATUA,880,880,880
0303060174,TRATAMENTO DE HIPERTENSAO PULMONAR,06,SIH,ATUA,512.78,512.78,512.78
0303060182,TRATAMENTO DE HIPERTENSAO SECUNDARIA,06,SIH,ATUA,172.34,172.34,172.34
0303060190,TRATAMENTO DE INFARTO AGUDO DO MIOCÁRDIO,06,SIH,ATUA,588.12,588.12,588.12
0303060204,TRATAMENTO DE INSUFICIENCIA ARTERIAL C/ ISQUEMIA CRITICA,06,SIH,ATUA,321.68,321.68,321.68
0303060212,TRATAMENTO DE INSUFICIENCIA CARDIACA,06,SIH,ATUA,699.46,699.46,699.46
0303060220,TRATAMENTO DE LINFADENITES INESPECIFICAS,06,SIH,ATUA,261.18,261.18,261.18
0303060239,TRATAMENTO DE MIOCARDIOPATIAS,06,SIH,ATUA,262.55,262.55,262.55
0303060247,TRATAMENTO DE OUTRAS VASCULOPATIAS,06,SIH,ATUA,219.33,219.33,219.33
0303060255,TRATAMENTO DE PARADA CARDIACA C/ RESSUSCITACAO,06,SIH,ATUA,326.43,326.43,326.43
0303060263,TRATAMENTO DE PE DIABETICO COMPLICADO,06,SIH,ATUA,321.68,321.68,321.68
0303060271,TRATAMENTO DE PERICARDITE,06,SIH,ATUA,212.9,212.9,212.9
0303060280,TRATAMENTO DE SINDROME CORONARIANA AGUDA,06,SIH,ATUA,325.08,325.08,325.08
0303060298,TRATAMENTO DE TROMBOSE VENOSA PROFUNDA,06,SIH,ATUA,322.48,322.48,322.48
0303060301,TRATAMENTO DE VARIZES DOS MEMBROS INFERIORES C/ ULCERA,06,SIH,ATUA,261.18,261.18,261.18
0303070013,DILATACAO DE ESOFAGO C/ OGIVAS SOB VISAO ENDOSCOPICA (POR SESSAO),06,SIA,ATUA,49.5,49.5,49.5
0303070021,HEMOPERFUSAO,06,SIH,ATUA,98.26,98.26,98.26
0303070030,REMOÇÃO MANUAL DE FECALOMA,01,PAB,ATUA,144.655601,159.207954,168.426095
0303070048,RETIRADA DE CORPO ESTRANHO DO ESOFAGO,06,SIA,ATUA,49.5,49.5,49.5
0303070056,RETIRADA DE CORPO ESTRANHO DO ESTOMAGO / DUODENO,06,SIA,ATUA,47.25,47.25,47.25
0303070064,TRATAMENTO DE DOENCAS DO ESOFAGO ESTOMAGO E DUODENO,06,SIH,ATUA,186.06,186.06,186.06
0303070072,TRATAMENTO DE DOENCAS DO FIGADO,06,SIH,ATUA,416.39,416.39,416.39
0303070080,TRATAMENTO DE DOENCAS DO PERITONIO,06,SIH,ATUA,251.76,251.76,251.76
0303070099,TRATAMENTO DE ENTERITES E COLITES NAO INFECCIOSAS,06,SIH,ATUA,204.15,204.15,204.15
0303070102,TRATAMENTO DE OUTRAS DOENCAS DO APARELHO DIGESTIVO,06,SIH,ATUA,347.15,347.15,347.15
0303070110,TRATAMENTO DE OUTRAS DOENCAS DO INTESTINO,06,SIH,ATUA,193.66,193.66,193.66
0303070129,TRATAMENTO DE TRANSTORNOS DAS VIAS BILIARES E PANCREAS,06,SIH,ATUA,270.38,270.38,270.38
0303070137,TRATAMENTO DE INTERCORRÊNCIA CLINICA PÓS-CIRURGIA BARIÁTRICA,04,SIH,ATUA,322,322,322
0303080019,CAUTERIZAÇÃO QUÍMICA DE PEQUENAS LESÕES,06,SIA,ATUA,1.48,1.48,1.48
0303080027,DESBASTAMENTO DE CALOSIDADE E/OU MAL PERFURANTE (DESBASTAMENTO),06,SIA,ATUA,1.48,1.48,1.48
0303080035,ESFOLIACAO QUIMICA,06,SIA,ATUA,1.48,1.48,1.48
0303080043,TRATAMENTO DE AFECCOES BOLHOSAS,06,SIH,ATUA,186.16,186.16,186.16
0303080051,TRATAMENTO DE DERMATITES E ECZEMAS,06,SIH,ATUA,224.91,224.91,224.91
0303080060,TRATAMENTO DE ESTAFILOCOCCIAS,06,SIH,ATUA,292.62,292.62,292.62
0303080078,TRATAMENTO DE ESTREPTOCOCCIAS,06,SIH,ATUA,292.62,292.62,292.62
0303080086,TRATAMENTO DE FARMACODERMIAS,06,SIH,ATUA,186.16,186.16,186.16
0303080094,TRATAMENTO DE OUTRAS AFECCOES DA PELE E DO TECIDO SUBCUTANEO,06,SIH,ATUA,182.57,182.57,182.57
0303080108,FOTOTERAPIA (POR SESSÃO),06,SIA,ATUA,4,4,4
0303080116,FOTOTERAPIA COM FOTOSSENSIBILIZAÇÃO (POR SESSÃO),06,SIA,ATUA,8,8,8
0303090014,ARTROCENTESE DE GRANDES ARTICULACOES,06,SIA,ATUA,30.69,30.69,30.69
0303090022,ARTROCENTESE DE PEQUENAS ARTICULACOES,06,NÃO,ATUA,0,0,0
0303090030,"INFILTRACAO DE SUBSTANCIAS EM CAVIDADE SINOVIAL (ARTICULACAO, BAINHA TENDINOSA)",06,SIA,ATUA,5.63,5.63,5.63
0303090049,INSTALACAO DE TRACAO CUTANEA,06,SP,ATUA,10.8,10.8,10.8
0303090073,REVISÃO COM TROCA DE APARELHO GESSADO EM MEMBRO INFERIOR,06,SIA,ATUA,25.31,25.31,25.31
0303090081,REVISÃO COM IMOBILIZAÇÃO NÃO GESSADA EM LESÃO DA COLUNA VERTEBRAL,06,SIA,ATUA,11,11,11
0303090090,REVISÃO COM TROCA DE APARELHO GESSADO EM MEMBRO SUPERIOR,06,SIA,ATUA,22.21,22.21,22.21
0303090111,REVISÃO COM TROCA DE APARELHO GESSADO EM LESÃO DA COLUNA VERTEBRAL,06,SIA,ATUA,27.32,27.32,27.32
0303090120,TRATAMENTO CONSERVADOR DE FRATURA NA CINTURA ESCAPULAR (COM IMOBILIZAÇÃO),06,SIA,ATUA,36.59,36.59,36.59
0303090138,TRATAMENTO CONSERVADOR DE FRATURA / LESAO LIGAMENTAR / ARRANCAMENTO OSSEO AO NIVEL DA PELVE,06,SIH,ATUA,157.73,157.73,157.73
0303090146,TRATAMENTO CONSERVADOR DE FRATURA DE COSTELAS,06,SIA,ATUA,15.04,15.04,15.04
0303090154,TRATAMENTO CONSERVADOR DE FRATURA DE PUNHO COM LUVA GESSADA,06,SIA,ATUA,40.68,40.68,40.68
0303090162,TRATAMENTO CONSERVADOR DE FRATURA DE OSSO METACÁRPICO,06,SIA,ATUA,17.85,17.85,17.85
0303090170,TRATAMENTO CONSERVADOR DE FRATURA DE OSSOS DA FACE,06,NÃO,ATUA,0,0,0
0303090189,TRATAMENTO CONSERVADOR DE FRATURA DO ESTERNO,06,SIA,ATUA,15.98,15.98,15.98
0303090197,TRATAMENTO CONSERVADOR DE FRATURA DOS ANEIS PELVICOS,06,SIH,ATUA,156.67,156.67,156.67
0303090200,TRATAMENTO CONSERVADOR DE FRATURA EM MEMBRO INFERIOR COM IMOBILIZAÇÃO,06,SIA,ATUA,41.93,41.93,41.93
0303090219,TRATAMENTO CONSERVADOR DE LESÃO DA COLUNA CERVICAL COM IMOBILIZAÇÃO,06,SIA,ATUA,47.58,47.58,47.58
0303090227,TRATAMENTO CONSERVADOR DE FRATURA EM MEMBRO SUPERIOR COM IMOBILIZAÇÃO,06,SIA,ATUA,41.63,41.63,41.63
0303090235,TRATAMENTO CONSERVADOR DE LESAO DA COLUNA TORACO-LOMBO-SACRA C/ ORTESE,06,SIA,ATUA,39.09,39.09,39.09
0303090243,TRATAMENTO CONSERVADOR DE LESAO DA COLUNA TORACO-LOMBO-SACRA S/ IMOBILIZACAO,06,NÃO,ATUA,0,0,0
0303090251,TRATAMENTO CONSERVADOR DE LESÃO DE COLUNA TORACO-LOMBO-SACRA COM IMOBILIZAÇÃO,06,SIA,ATUA,47.58,47.58,47.58
0303090260,TRATAMENTO CONSERVADOR DE LESÃO DE MECANISMO EXTENSOR DOS DEDOS,06,SIA,ATUA,17.85,17.85,17.85
0303090286,TRATAMENTO CONSERVADOR DE LESÃO LIGAMENTAR EM MEMBRO COM IMOBILIZAÇÃO,06,SIA,ATUA,35.2,35.2,35.2
0303090294,TRATAMENTO CONSERVADOR DE LUMBAGO OU DORSALGIA REFRATARIOS,06,NÃO,ATUA,0,0,0
0303090308,TRATAMENTO CONSERVADOR DE OSTEOMIELITE AGUDA,06,SIA,2008,18.27,18.27,18.27
0303090316,TRATAMENTO DAS POLIARTROPATIAS INFLAMATORIAS,06,SIH,ATUA,190.7,190.7,190.7
0303090324,TRATAMENTO DE ARTRITE REUMATOIDE,06,SIH,2008,229.13,229.13,229.13
0303090332,TRATAMENTO DE DOENCAS SISTEMICAS DO TECIDO CONJUNTIVO,06,SIH,2008,217.67,217.67,217.67
0303090340,TRATAMENTO DE ESPONDILITE ANCILOSANTE,06,SIH,2008,150.55,150.55,150.55
0303090359,TRATAMENTO DE OSTEITE,06,SIH,2008,150.55,150.55,150.55
0303090367,TRATAMENTO DE OSTEOPOROSE,06,SIH,2008,150.55,150.55,150.55
0303090375,TRATAMENTO DE OUTRAS DOENCAS OSSEAS,06,SIH,2008,150.55,150.55,150.55
0303100010,TRATAMENTO DE COMPLICACOES RELACIONADAS PREDOMINANTEMENTE AO PUERPERIO,06,SIH,ATUA,154.3,154.3,154.3
0303100028,TRATAMENTO DE ECLAMPSIA,06,SIH,ATUA,123.99,123.99,123.99
0303100036,"TRATAMENTO DE EDEMA, PROTEINURIA E TRANSTORNOS HIPERTENSIVOS NA GRAVIDEZ PARTO E PUERPERIO",06,SIH,ATUA,123.99,123.99,123.99
0303100044,TRATAMENTO DE INTERCORRENCIAS CLINICAS NA GRAVIDEZ,06,SIH,ATUA,109.24,109.24,109.24
0303100052,TRATAMENTO DE MOLA HIDATIFORME,06,SIH,ATUA,68.86,68.86,68.86
0303110015,TRATAMENTO DAS MALFORMACOES E DEFORMIDADES CONGENITAS DO SISTEMA OSTEOMUSCULAR,06,SIH,ATUA,162.45,162.45,162.45
0303110023,TRATAMENTO DE ANOMALIAS CROMOSSOMICAS NAO CLASSIFICADAS EM OUTRA PARTE,06,SIH,ATUA,282.57,282.57,282.57
0303110031,TRATAMENTO DE ESPINHA BIFIDA,06,SIH,ATUA,334.96,334.96,334.96
0303110040,TRATAMENTO DE MALFORMACOES CONGENITAS DO APARELHO CIRCULATORIO,06,SIH,ATUA,626.41,626.41,626.41
0303110058,TRATAMENTO DE FENDA LABIAL E/OU FENDA PALATINA,06,SIH,ATUA,404.39,404.39,404.39
0303110066,TRATAMENTO DE MALFORMACOES CONGENITAS DO APARELHO URINARIO,06,SIH,ATUA,285.96,285.96,285.96
0303110074,TRATAMENTO DE MALFORMACOES CONGENITAS DOS ORGAOS GENITAIS,06,SIH,ATUA,230.76,230.76,230.76
0303110082,TRATAMENTO DE NEUROFIBROMATOSE,06,SIH,ATUA,204.02,204.02,204.02
0303110090,TRATAMENTO DE OUTRAS ANOMALIAS CONGENITAS DO SISTEMA NERVOSO,06,SIH,ATUA,334.96,334.96,334.96
0303110104,TRATAMENTO DE OUTRAS MALFORMACOES CONGENITAS,06,SIH,ATUA,189.61,189.61,189.61
0303110112,TRATAMENTO DE OUTRAS MALFORMACOES CONGENITAS DO APARELHO DIGESTIVO,06,SIH,ATUA,366.74,366.74,366.74
0303120010,IODOTERAPIA DE CARCIOMA DIFERENCIADO DA TIREOIDE (250 MCI),06,SIH,2008,1757.58,1757.58,1757.58
0303120029,TRATAMENTO DE CARCINOMA DA TIREOIDE,06,NÃO,ATUA,0,0,0
0303120037,TRATAMENTO DE HIPERTIROIDISMO,06,NÃO,ATUA,0,0,0
0303120045,TRATAMENTO DE CARDIOTOXICOSE POR HIPERTIROIDISMO (ATE 50 MCI),06,NÃO,ATUA,0,0,0
0303120053,TRATAMENTO DE DOR/METÁSTASE ÓSSEA COM RADIOISÓTOPO (POR TRATAMENTO-EXCETO CÂNCER DE TIREOIDE),06,SIA,ATUA,468.38,468.38,468.38
0303120061,TRATAMENTO DE HIPERTIREOIDISMO (PLUMMER - ATE 30 MCI),06,SIA,ATUA,443.7,443.7,443.7
0303120070,TRATAMENTO DE HIPERTIREOIDISMO GRAVES,06,SIA,ATUA,359.7,359.7,359.7
0303130016,ATENDIMENTO A PACIENTE SOB CUIDADOS PROLONGADOS DEVIDO A CAUSAS EXTERNAS,06,SIH,ATUA,66.47,66.47,66.47
0303130024,ATENDIMENTO A PACIENTE SOB CUIDADOS PROLONGADOS POR ENFERMIDADES CARDIOVASCULARES,06,SIH,ATUA,74.75,74.75,74.75
0303130032,ATENDIMENTO A PACIENTE SOB CUIDADOS PROLONGADOS POR ENFERMIDADES PNEUMOLOGICAS,06,SIH,ATUA,73.72,73.72,73.72
0303130040,TRATAMENTO DE PACIENTE SOB CUIDADOS PROLONGADOS POR ENFERMIDADES DECORRENTES DA AIDS,06,SIH,ATUA,123.83,123.83,123.83
0303130059,TRATAMENTO DE PACIENTE SOB CUIDADOS PROLONGADOS POR ENFERMIDADES NEUROLOGICAS,06,SIH,ATUA,70.61,70.61,70.61
0303130067,TRATAMENTO DE PACIENTE SOB CUIDADOS PROLONGADOS POR ENFERMIDADES ONCOLOGICAS,06,SIH,ATUA,71.65,71.65,71.65
0303130075,TRATAMENTO DE PACIENTE SOB CUIDADOS PROLONGADOS POR ENFERMIDADES OSTEOMUSCULARES E DO TECIDO CONJUNTIVO,06,SIH,ATUA,68.54,68.54,68.54
0303130083,TRATAMENTO DE PACIENTES SOB CUIDADOS PROLONGADOS EM HANSENIASE,06,SIH,ATUA,28.69,28.69,28.69
0303140011,LAVAGEM NASAL PELO METODO DE PROETZ (POR SESSAO),06,SIA,ATUA,1.44,1.44,1.44
0303140020,TRATAMENTO DA FIBROSE CISTICA COM MANIFESTACOES PULMONARES,06,SIH,ATUA,432.68,432.68,432.68
0303140038,TRATAMENTO DAS AFECCOES NECROTICAS E SUPURATIVAS DAS VIAS AEREAS INFERIORES,06,SIH,ATUA,481.41,481.41,481.41
0303140046,TRATAMENTO DAS DOENCAS CRONICAS DAS VIAS AEREAS INFERIORES,06,SIH,ATUA,479.19,479.19,479.19
0303140054,TRATAMENTO DAS DOENCAS PULMONARES DEVIDO A AGENTES EXTERNOS,06,SIH,ATUA,358.35,358.35,358.35
0303140062,TRATAMENTO DE CARDIOPATIA PULMONAR NAO ESPECIFICADA (COR PULMONALE),06,SIH,ATUA,623.26,623.26,623.26
0303140070,TRATAMENTO DE DOENCA DO OUVIDO EXTERNO MEDIO E DA MASTOIDE,06,SIH,ATUA,147.71,147.71,147.71
0303140089,TRATAMENTO DE DOENCAS RESPIRATORIAS QUE AFETAM PRINCIPALMENTE O INTERSTICIO,06,SIH,ATUA,448.87,448.87,448.87
0303140097,TRATAMENTO DE HEMORRAGIAS DAS VIAS RESPIRATORIAS,06,SIH,ATUA,172.34,172.34,172.34
0303140100,TRATAMENTO DE INFECCOES AGUDAS DAS VIAS AEREAS SUPERIORES,06,SIH,ATUA,177.07,177.07,177.07
0303140119,TRATAMENTO DE OUTRAS DOENCAS DA PLEURA,06,SIA,ATUA,11.84,11.84,11.84
0303140127,TRATAMENTO DE OUTRAS DOENCAS DAS VIAS AEREAS SUPERIORES,06,SIH,ATUA,185.83,185.83,185.83
0303140135,TRATAMENTO DE OUTRAS DOENCAS DO APARELHO RESPIRATORIO,06,SIH,ATUA,480.87,480.87,480.87
0303140143,TRATAMENTO DE OUTRAS INFECCOES AGUDAS DAS VIAS AEREAS INFERIORES,06,SIH,ATUA,187.13,187.13,187.13
0303140151,TRATAMENTO DE PNEUMONIAS OU INFLUENZA (GRIPE),06,SIH,ATUA,582.42,582.42,582.42
0303150017,TRATAMENTO DE DOENCAS DOS ORGAOS GENITAIS MASCULINOS,06,SIH,ATUA,67.31,67.31,67.31
0303150025,TRATAMENTO DE DOENCAS GLOMERULARES,06,SIH,ATUA,331.54,331.54,331.54
0303150033,TRATAMENTO DE DOENCAS INFLAMATORIAS DOS ORGAOS PELVICOS FEMININOS,06,SIH,ATUA,198.81,198.81,198.81
0303150041,TRATAMENTO DE DOENCAS RENAIS TUBULO-INTERSTICIAIS,06,SIH,ATUA,347.95,347.95,347.95
0303150050,TRATAMENTO DE OUTRAS DOENCAS DO APARELHO URINARIO,06,SIH,ATUA,218.68,218.68,218.68
0303150068,TRATAMENTO DE OUTROS TRANSTORNOS DO RIM E DO URETER,06,SIH,ATUA,272.97,272.97,272.97
0303160012,TRATAMENTO DE ENTERITE NECROSANTE DO FETO E DO RECEM-NASCIDO,06,SIH,ATUA,166.08,166.08,166.08
0303160020,TRATAMENTO DE INFECCOES ESPECIFICAS DO PERIODO PERINATAL,06,SIH,ATUA,224.97,224.97,224.97
0303160039,TRATAMENTO DE OUTROS TRANSTORNOS ORIGINADOS NO PERIODO PERINATAL,06,SIH,ATUA,262.54,262.54,262.54
0303160047,TRATAMENTO DE TRANSTORNOS HEMORRAGICOS E HEMATOLOGICOS DO FETO E DO RECEM-NASCIDO,06,SIH,ATUA,262.54,262.54,262.54
0303160055,TRATAMENTO DE TRANSTORNOS RELACIONADOS C/ A DURACAO DA GESTACAO E C/ O CRESCIMENTO FETAL,06,SIH,ATUA,778.02,778.02,778.02
0303160063,TRATAMENTO DE TRANSTORNOS RESPIRATORIOS E CARDIOVASCULARES ESPECIFICOS DO PERIODO NEONATAL,06,SIH,ATUA,482.45,482.45,482.45
0303160071,TRATAMENTO DE TRAUMATISMO DE PARTO NO NEONATO,06,SIH,ATUA,170.35,170.35,170.35
0303170018,DIAGNOSTICO E/OU ATENDIMENTO DE URGENCIA EM PSIQUIATRIA,06,SIH,2012,55,55,55
0303170026,TRATAMENTO DA INTOXICACAO AGUDA  EM USUARIOS DE ALCOOL E OUTRAS DROGAS,06,SIH,2012,130,130,130
0303170034,TRATAMENTO DA SINDROME DE ABSTINENCIA DO ALCOOL EM SERVICO HOSPITALAR DE REFERENCIA PARA A ATENCAO INTEGRAL AOS USUARIOS DE ALCOOL EM OUTRAS DROGAS (POR DIA),06,SIH,2012,70,70,70
0303170042,TRATAMENTO DE DEPENDENCIA DO ALCOOL EM SERVICO HOSPITALAR DE REFERENCIA PARA A ATENCAO INTEGRAL AOS USUARIOS DE ALCOOL E OUTRAS DROGAS (POR DIA),06,SIH,2012,65,65,65
0303170050,TRATAMENTO DE SINDROME DE ABSTINENCIA POR USO PREJUDICIAL DE ALCOOL E DROGAS,06,SIH,2012,31.77,31.77,31.77
0303170069,TRATAMENTO DE TRANSTORNOS MENTAIS E COMPORTAMENTAIS DEVIDOS AO USO DE SUBSTANCIAS PSICOATIVAS,06,SIH,2012,31.77,31.77,31.77
0303170077,TRATAMENTO EM PSIQUIATRIA (CLASSIFICACAO PT GM 251/02),06,SIH,2011,26.91,26.91,26.91
0303170085,TRATAMENTO EM PSIQUIATRIA  - EM HOSPITAL GERAL (POR DIA),06,SIH,2012,56,56,56
0303170093,TRATAMENTO EM PSIQUIATRIA (POR DIA),06,SIH,ATUA,26.91,26.91,26.91
0303170107,TRATAMENTO EM PSIQUIATRIA EM HOSPITAL DIA,06,SIH,ATUA,39.88,39.88,39.88
0303170115,TRATAMENTO A PACIENTES QUE FAZEM USO DE COCAÍNA E DERIVADOS EM HOSPITAL DE REFERÊNCIA PARA ATENÇÃO INTEGRAL AOS USUÁRIOS DE ÁLCOOL E OUTRAS DROGAS- POR DIA,04,SIH,2012,112,112,112
0303170123,TRATAMENTO DE PACIENTES QUE FAZEM USO DE COCAÍNA E DERIVADOS COM COMORBIDADE EM HOSPITAL DE REFERÊNCIA PARA ATENÇÃO INTEGRAL AOS USUÁRIOS DE ÁLCOOL E OUTRAS DROGAS - POR DIA,04,SIH,2012,112,112,112
0303170131,TRATAMENTO CLÍNICO EM SAÚDE MENTAL EM SITUAÇÃO DE RISCO ELEVADO DE SUICÍDIO.,06,SIH,ATUA,57,57,57
0303170140,TRATAMENTO CLÍNICO PARA CONTENÇÃO DE COMPORTAMENTO DESORGANIZADO E/OU DISRUPTIVO,06,SIH,ATUA,57,57,57
0303170158,"TRATAMENTO CLÍNICO PARA AVALIAÇÃO DIAGNÓSTICA E ADEQUAÇÃO TERAPÊUTICA, INCLUINDO NECESSIDADES DE SAÚDE DECORRENTES DO USO DE ÁLCOOL E OUTRAS DROGAS",06,SIH,ATUA,57,57,57
0303170166,TRATAMENTO CLÍNICO DE TRANSTORNOS MENTAIS E COMPORTAMENTAIS DEVIDO AO USO DE ÁLCOOL,06,SIH,ATUA,57,57,57
0303170174,TRATAMENTO CLÍNICO DE TRANSTORNOS MENTAIS E COMPORTAMENTAIS DEVIDO AO USO DE CRACK.,06,SIH,ATUA,57,57,57
0303170182,TRATAMENTO CLÍNICO DOS TRANSTORNOS MENTAIS E COMPORTAMENTAIS DEVIDO AO USO DAS DEMAIS DROGAS E/OU OUTRAS SUBSTÂNCIAS PSICOATIVAS,06,SIH,ATUA,57,57,57
0303170190,TRATAMENTO EM PSIQUIATRIA DE CURTA PERMANENCIA POR DIA (PERMANENCIA ATÉ 90 DIAS),06,SIH,ATUA,26.91,26.91,26.91
0303170204,TRATAMENTO EM PSIQUIATRIA POR DIA (COM DURAÇÃO SUPERIOR A 90 DIAS DE INTERNAÇÃO OU REINTERNAÇÃO ANTES DE 30 DIAS),06,SIH,ATUA,26.91,26.91,26.91
0303180013,TRATAMENTO DE AFECÇÕES ASSOCIADAS AO HIV/AIDS,06,NÃO,ATUA,0,0,0
0303180030,TRATAMENTO DE AFECÇÕES DO APARELHO DIGESTIVO EM HIV/AIDS,06,SIH,ATUA,293.59,293.59,293.59
0303180048,TRATAMENTO DE AFECÇÕES DO SISTEMA NERVOSO EM HIV/AIDS,06,SIH,ATUA,606.69,606.69,606.69
0303180056,TRATAMENTO DE AFECÇÕES DO SISTEMA RESPIRATÓRIO EM HIV/AIDS,06,SIH,ATUA,573.25,573.25,573.25
0303180064,TRATAMENTO DE DOENÇAS DISSEMINADAS EM AIDS,06,SIH,ATUA,507.07,507.07,507.07
0303180072,TRATAMENTO DE HIV / AIDS,06,SIH,ATUA,23.45,23.45,23.45
0303190019,TRATAMENTO EM REABILITACAO,06,SIH,ATUA,43.04,43.04,43.04
0304010014,BETATERAPIA DÉRMICA (POR CAMPO),06,SIA,2019,6.27,6.27,6.27
0304010022,BETATERAPIA OFTÁLMICA (POR CAMPO),06,SIA,2019,23,23,23
0304010030,BETATERAPIA PARA PROFILAXIA DE PTERÍGIO (POR CAMPO),06,SIA,2019,23,23,23
0304010049,BRAQUITERAPIA,06,SIH,2019,2000,2000,2000
0304010057,BRAQUITERAPIA COM FIOS DE IRIDIUM,06,SIH,2019,2500,2500,2500
0304010065,BRAQUITERAPIA COM IODO 125 / OURO 198,06,SIH,2019,2500,2500,2500
0304010073,BRAQUITERAPIA DE ALTA TAXA DE DOSE (POR INSERÇÃO),06,SIA,2019,1000,1000,1000
0304010081,VERIFICAÇÂO POR IMAGEM EM RADIOTERAPIA,06,SIA,2019,30,30,30
0304010090,COBALTOTERAPIA (POR CAMPO),06,SIA,2019,30,30,30
0304010103,IMPLANTAÇÃO DE HALO PARA RADIOCIRURGIA,06,SIA,2019,35,35,35
0304010111,INTERNACAO P/ RADIOTERAPIA EXTERNA (COBALTOTERAPIA / ACELERADOR LINEAR),06,SIH,ATUA,23.08,23.08,23.08
0304010120,IRRADIACAO DE CORPO INTEIRO PRÉ-TRANSPLANTE DE MEDULA ÓSSEA,06,SIA,2019,375,375,375
0304010138,IRRADIAÇÃO DE MEIO CORPO,06,SIA,2019,126.72,126.72,126.72
0304010146,IRRADIAÇÃO DE PELE TOTAL,06,SIA,2019,132,132,132
0304010154,MÁSCARA / IMOBILIZAÇÃO PERSONALIZADA (POR TRATAMENTO),06,SIA,2019,65,65,65
0304010162,MOLDAGEM EM COLO E/OU CORPO DO UTERO,06,SIH,2019,2000,2000,2000
0304010170,NARCOSE DE CRIANÇA (POR PROCEDIMENTO),06,SIA,ATUA,22,22,22
0304010189,PLANEJAMENTO COMPLEXO (POR TRATAMENTO),06,SIA,2019,120,120,120
0304010197,PLANEJAMENTO DE BRAQUITERAPIA DE ALTA TAXA DE DOSE (POR TRATAMENTO),06,SIA,2019,120,120,120
0304010200,PLANEJAMENTO SIMPLES (POR TRATAMENTO),06,SIA,2019,60,60,60
0304010219,RADIOCIRURGIA - UM ISOCENTRO,06,SIA,2019,5000,5000,5000
0304010227,RADIOCIRURGIA POR GAMA-KNIFE - HUM ISOCENTRO,04,SIA,2010,5000,5000,5000
0304010235,RADIOTERAPIA DE DOENÇA OU CONDIÇÃO BENIGNA (POR CAMPO),06,SIA,2019,6.27,6.27,6.27
0304010243,RADIOTERAPIA ESTEREOTÁXICA FRACIONADA,06,SIA,2019,5000,5000,5000
0304010251,RADIOTERAPIA P/ PROFILAXIA DE QUELOIDE (POR CAMPO),06,SIA,2008,2.2,2.2,2.2
0304010260,ROENTGENTERAPIA (POR CAMPO),06,SIA,2019,25,25,25
0304010278,ROENTGENTERAPIA PROFUNDA 150-500 KV (POR CAMPO-MAXIMO DE 30 POR AREA),06,SIA,2008,6.27,6.27,6.27
0304010286,RADIOTERAPIA COM ACELERADOR LINEAR SÓ DE FÓTONS (POR CAMPO),06,SIA,2019,30,30,30
0304010294,RADIOTERAPIA COM ACELERADOR LINEAR DE FÓTONS E ELÉTRONS (POR CAMPO),06,SIA,2019,35,35,35
0304010308,COLIMAÇÃO PERSONALIZADA,06,SIA,2019,52,52,52
0304010316,PLANEJAMENTO TRIDIMENSIONAL (POR TRATAMENTO).,06,SIA,2019,480,480,480
0304010324,MOLDAGEM/IMPLANTE EM MUCOSA (POR TRATAMENTO COMPLETO),06,SIH,2019,737.63,737.63,737.63
0304010332,MOLDAGEM/IMPLANTE EM PELE/MUCOSA (POR TRATAMENTO COMPLETO),06,SIH,2019,737.63,737.63,737.63
0304010340,NARCOSE PARA BRAQUITERAPIA (POR PROCEDIMENTO),06,SIA,ATUA,22,22,22
0304010359,INTERNAÇÃO PARA RADIOTERAPIA ESTEREOTÁXICA DO SISTEMA NERVOSO CENTRAL,06,SIH,ATUA,23.08,23.08,23.08
0304010367,RADIOTERAPIA DE CABEÇA E PESCOÇO,06,SIA,ATUA,4168,4168,4168
0304010375,RADIOTERAPIA DO APARELHO DIGESTIVO,06,SIA,ATUA,4148,4148,4148
0304010383,"RADIOTERAPIA DE TRAQUEIA, BRÔNQUIO, PULMÃO, PLEURA E MEDIASTINO",06,SIA,ATUA,3563,3563,3563
0304010391,RADIOTERAPIA DE OSSOS/CARTILAGENS/PARTES MOLES,06,SIA,ATUA,3118,3118,3118
0304010405,RADIOTERAPIA DE PELE,06,SIA,ATUA,2310,2310,2310
0304010413,RADIOTERAPIA DE MAMA,06,SIA,ATUA,5904,5904,5904
0304010421,RADIOTERAPIA DE CÂNCER GINECOLÓGICO,06,SIA,ATUA,4608,4608,4608
0304010430,BRAQUITERAPIA GINECOLÓGICA,06,SIA,ATUA,4150,4150,4150
0304010448,RADIOTERAPIA DE PÊNIS,06,SIA,ATUA,4630,4630,4630
0304010456,RADIOTERAPIA DE PRÓSTATA,06,SIA,ATUA,5838,5838,5838
0304010464,BRAQUITERAPIA DE PRÓSTATA,06,SIA,ATUA,5838,5838,5838
0304010472,RADIOTERAPIA DO APARELHO URINÁRIO,06,SIA,ATUA,4093,4093,4093
0304010480,RADIOTERAPIA DE OLHOS E ANEXOS,06,SIA,ATUA,3273,3273,3273
0304010499,BRAQUITERAPIA OFTÁLMICA,06,SIH,ATUA,9500,9500,9500
0304010502,RADIOTERAPIA DE SISTEMA NERVOSO CENTRAL,06,SIA,ATUA,3278,3278,3278
0304010510,RADIOTERAPIA ESTEREOTÁXICA,06,SIA,ATUA,5035,5035,5035
0304010529,RADIOTERAPIA DE METÁSTASE EM SISTEMA NERVOSO CENTRAL,06,SIA,ATUA,2439,2439,2439
0304010537,RADIOTERAPIA DE PLASMOCITOMA / MIELOMA / METÁSTASES EM OUTRAS LOCALIZAÇÕES,06,SIA,ATUA,1729,1729,1729
0304010545,RADIOTERAPIA DE CADEIA LINFÁTICA,06,SIA,ATUA,4168,4168,4168
0304010553,RADIOTERAPIA DE LINFOMA E LEUCEMIA,06,SIA,ATUA,3159,3159,3159
0304010561,RADIOTERAPIA EM CORPO INTEIRO,06,SIA,ATUA,1729,1729,1729
0304010570,RADIOTERAPIA DE QUELOIDE E GINECOMASTIA,06,SIA,ATUA,953,953,953
0304010588,RADIOTERAPIA DE DOENÇA BENIGNA,06,SIA,ATUA,593,593,593
0304010596,INTERNAÇÃO PARA BRAQUITERAPIA,06,SIH,ATUA,23.08,23.08,23.08
0304020010,QUIMIOTERAPIA DO ADENOCARCINOMA DE COLON AVANÇADO -1ª LINHA,06,SIA,ATUA,2224,2224,2224
0304020028,QUIMIOTERAPIA DO ADENOCARCINOMA DE COLON AVANÇADO - 2ª LINHA,06,SIA,ATUA,2224,2224,2224
